date,Article Headline,Article URL,Article Text,overall_sentiment_score,overall_sentiment_label,Stock Open,Stock Close,Stock High,Stock Low,volume,num_trades,adj_close
2022-08-22,"Down 22% in 2022, Should You Buy the Dip on This Monster Stock?",https://www.fool.com/investing/2022/08/22/down-in-2022-should-you-buy-dip-on-monster-stock/,"The market has unfairly punished even steady and competitively advantaged businesses, giving investors a great opportunity.",0.267687,Somewhat-Bullish,318.09,312.21,319.74,311.71,3141130.0,76427.0,314.674157
2022-08-23,"How to combat inflation with Labor Day deals - 'Sales have already started,' says shopping expert, with discounts of 50% or more",https://www.cnbc.com/2022/08/23/here-are-tips-on-how-to-combat-inflation-with-labor-day-deals.html,"To make the most of Labor Day sales, shopping experts recommend sticking to seasonal items, such as summer clothing, patio furniture and grills.",0.230907,Somewhat-Bullish,311.21,306.9,311.515,305.64,3310704.0,70658.0,307.409173
2022-08-24,Retailers Q2 Earnings Disappoint: ETFs in Focus,https://www.zacks.com/stock/news/1971950/retailers-q2-earnings-disappoint-etfs-in-focus,"Total earnings from 93.9% of the sector's total market capitalization reported so far are down 21.4% on 7.9% higher revenues, with 72% beating EPS estimates and 44% beating revenue estimates.",0.140109,Neutral,305.05,308.11,309.98,303.55,2485855.0,50325.0,307.831971
2022-08-25,These dividend stocks can protect you as the Federal Reserve slows the economy,https://www.marketwatch.com/story/these-dividend-stocks-can-protect-you-as-the-federal-reserve-slows-the-economy-11661443792,This guide highlights which real estate investment trusts are expected to generate the most cash for investors in 2023.,0.137815,Neutral,308.64,309.78,309.96,305.83,2522810.0,53179.0,308.519165
2022-08-26,Check Out What Whales Are Doing With Home Depot,https://www.benzinga.com/markets/options/22/08/28652649/check-out-what-whales-are-doing-with-home-depot,"Someone with a lot of money to spend has taken a bullish stance on Home Depot HD. We noticed this today when the big position showed up on publicly available options history that we track here at Benzinga. Whether this is an institution or just a wealthy individual, we don't know.",0.154473,Somewhat-Bullish,310.3,298.1,311.505,298.02,3304612.0,74849.0,302.218482
2022-08-29,3 Stocks to Add to Your Portfolio in a Market Pullback,https://www.fool.com/investing/2022/08/29/3-stocks-to-add-to-your-portfolio-in-a-market-pull/,These three companies have the ability to thrive during a recession.,0.234431,Somewhat-Bullish,296.57,296.32,299.71,294.29,2703133.0,60333.0,296.972238
2022-08-30,"How I'd Invest $20,000 Today If I Had to Start From Scratch",https://www.fool.com/investing/2022/08/30/how-id-invest-20000-today-if-i-had-to-start-from-s/,I'd focus my investments on four specific categories that I believe will set a portfolio up for long-term outperformance.,0.1478,Neutral,298.56,293.1,299.9,291.67,2873662.0,65275.0,293.637328
2022-08-31,"Home Depot  ( NYSE:HD )  Upgraded by StockNews.com to ""Buy""",https://www.etfdailynews.com/2022/08/31/home-depot-nysehd-upgraded-by-stocknews-com-to-buy/,"StockNews.com upgraded shares of Home Depot ( NYSE:HD - Get Rating ) from a hold rating to a buy rating in a report released on Tuesday morning. Several other equities analysts also recently issued reports on HD. MKM Partners assumed coverage on shares of Home Depot in a report on Thursday, ...",0.277708,Somewhat-Bullish,292.01,288.42,292.468,288.28,4360404.0,69088.0,289.545136
2022-09-01,What Stocks Are Directly Impacted By A Housing Market Recession?,https://www.forbes.com/sites/qai/2022/09/01/what-stocks-are-directly-impacted-by-a-housing-market-recession/,"Why is a housing market recession expected? What sectors will be directly affected and what stocks should you keep an eye on for now? Homebuilders, realtors, REITs, and retailers.",0.103246,Neutral,288.4,293.37,293.58,286.72,3721259.0,75178.0,290.539415
2022-09-02,Ethereum  ( $ETH )  - Crypto Adoption In Retail Continues To Grow During Bear Market: 'A Massive Opportunity',https://www.benzinga.com/fintech/22/09/28721775/interviews-study-shows-use-of-crypto-with-retailers-continues-to-grow-in-bear-market,"There is always hope, even going into the fifth month of the crypto bear market. For those who can't bear to keep following the prices ( pun intended ) , we focus on following the projects of the projects themselves, which create the value. On Sept. 6, the center of that hope is the merge of ...",0.326074,Somewhat-Bullish,296.11,291.9,296.8,290.1217,2729347.0,60339.0,293.218116
2022-09-06,This Real Estate Stock Is a Must-Own for Any Dividend Investor,https://www.fool.com/investing/2022/09/06/real-estate-stock-must-own-any-dividend-investor/,This Dividend Aristocrat offers reliability with an attractive 4.3% yield.,0.153196,Somewhat-Bullish,293.22,289.54,294.5,287.26,4075677.0,67416.0,289.807526
2022-09-07,What Stocks To Buy Today? 3 Cyclical Stocks To Watch Now,https://stockmarket.com/investing/defense-stocks/what-stocks-to-buy-today-3-cyclical-stocks-to-watch-now-2022-09-07,"Are These The Best Cyclical Stocks To Buy In The Stock Market Today? Cyclical stocks are stocks that tend to follow the ups and downs of the economy. Cyclicals are usually businesses that are affected by changes in consumer spending, such as automakers, airlines, and retailers.",0.288129,Somewhat-Bullish,290.44,297.47,297.7,290.3,2996309.0,58571.0,295.369146
2022-09-08,Housing Market Stocks And Trends For Q4 2022,https://www.forbes.com/sites/qai/2022/09/08/housing-market-stocks-and-trends-for-q4-2022/,"The housing market is changing right now, here's what buyers and investors need to know in 2022. All signs are pointing to lower home prices and a buyer's market.",0.026701,Neutral,296.0,299.9,300.1899,294.54,2667835.0,64136.0,298.776122
2022-09-09,"Apple  ( NASDAQ:AAPL )  - Tesla Fame's Robot-Run ETF Sold Its Entire Apple Stake In August And Bought Into Retail, Energy Sectors",https://www.benzinga.com/trading-ideas/long-ideas/22/09/28806943/this-robot-run-etf-cashes-out-of-apple-and-these-technology-stocks-in-august-heres-what-,"A large-cap-momentum-focused, AI-powered exchange-traded fund ( ETF ) sponsored by Qraft Technologies shed its entire Apple Inc. AAPL stake in August, according to an update on monthly holdings issued by the South Korea-based company. What Happened: The QRAFT AI-Enhanced U.S.",0.126482,Neutral,299.48,299.77,302.49,298.33,2761766.0,69872.0,299.966144
2022-09-12,Home Depot  ( NYSE:HD )  - Looking At Home Depot's Recent Whale Trades,https://www.benzinga.com/markets/options/22/09/28833206/looking-at-home-depots-recent-whale-trades,"A whale with a lot of money to spend has taken a noticeably bearish stance on Home Depot. Looking at options history for Home Depot HD we detected 23 strange trades. If we consider the specifics of each trade, it is accurate to state that 39% of the investors opened trades with bullish ...",0.136843,Neutral,300.8,297.54,302.83,296.35,3601038.0,82378.0,298.656123
2022-09-13,"Got $1,000? This Dow Jones Stock Is a Screaming Buy",https://www.fool.com/investing/2022/09/13/got-1000-this-dow-jones-stock-is-a-screaming-buy/,Long-term investors should be licking their chops amid the ongoing stock market correction.,0.214188,Somewhat-Bullish,292.01,277.93,294.08,277.32,4760051.0,127637.0,282.611493
2022-09-14,Cybersecurity myths every board member should dismiss,https://www.fastcompany.com/90784429/cybersecurity-myths-every-board-member-should-dismiss,"Although the majority of board of directors ( BODs ) view cybersecurity as a business risk, only four out of 10 organizations feature cybersecurity on the quarterly boardroom agenda. Having a cybersecurity blindspot at the board level can lead to some serious consequences from an overall ...",-0.200263,Somewhat-Bearish,279.4,276.34,279.54,273.17,4170846.0,94116.0,276.23735
2022-09-15,Why Is Home Depot  ( HD )  Down 15.2% Since Last Earnings Report?,https://www.zacks.com/stock/news/1980995/why-is-home-depot-hd-down-152-since-last-earnings-report,Home Depot (HD) reported earnings 30 days ago. What's next for the stock? We take a look at earnings estimates for some clues.,0.230092,Somewhat-Bullish,277.89,271.54,278.01,270.54,3867363.0,93095.0,273.467605
2022-09-16,Veteran billionaire US investor says no gains to be made in share markets in next 10 years | The Financial Express,https://www.financialexpress.com/market/veteran-billionaire-us-investor-says-no-gains-to-be-made-in-share-markets-in-next-10-years/2671127/,Veteran billionaire US investor says no gains to be made in share markets in next 10 years The Financial Express ...,-0.041235,Neutral,269.05,275.97,276.56,268.9,9504863.0,103491.0,274.405841
2022-09-19,Should You Invest in the Vanguard Consumer Discretionary ETF  ( VCR ) ?,https://www.zacks.com/stock/news/1981851/should-you-invest-in-the-vanguard-consumer-discretionary-etf-vcr,Sector ETF report for ...,0.243754,Somewhat-Bullish,273.58,280.42,281.23,273.51,3032025.0,69538.0,279.290068
2022-09-20,Wonder where the economy is heading? Keep an eye on earnings | Business,https://www.cnn.com/2022/09/20/investing/earnings-economy-corporate-america-recession,Wonder where the economy is heading? Keep an eye on earnings ...,-0.196261,Somewhat-Bearish,276.88,274.17,278.78,271.37,2919179.0,68258.0,274.424333
2022-09-21,Which Industries Are Impacted The Most By Lumber Prices?,https://www.forbes.com/sites/qai/2022/09/21/which-industries-are-impacted-the-most-by-lumber-prices/,"The price of lumber skyrocketed in 2021 when folks spent more money on DIY home improvement projects, unable to travel and dine out. Now that the cost of lumber has decreased somewhat, let's look at the impact in the market, and what it means for investors right now.",0.017025,Neutral,276.0,271.57,280.13,271.51,3138099.0,80713.0,275.778672
2022-09-22,Rising mortgage rates hit home builders as buyers pull back | Business,https://www.cnn.com/2022/09/22/economy/mortgage-rates-homebuilders/index.html,Rising mortgage rates hit home builders as buyers pull back ...,-0.026565,Neutral,271.22,269.14,271.22,267.85,3494817.0,76682.0,269.281373
2022-09-23,Better Buy: Amazon vs. Home Depot,https://www.fool.com/investing/2022/09/23/better-buy-amazon-vs-home-depot/,Amazon and Home Depot shares look cheap at today's levels.,0.207505,Somewhat-Bullish,267.89,270.94,271.3,266.32,3496351.0,89077.0,269.316761
2022-09-26,New Utah startup lets you return purchases from home,https://www.benzinga.com/pressreleases/22/09/n29017110/new-utah-startup-lets-you-return-purchases-from-home,"SALT LAKE CITY, Sept. 26, 2022 /PRNewswire/ -- An early-stage startup born in the heart of Utah's Silicon Slopes, Oops offers doorstep return pickups for in-store and online purchases across the Wasatch Range.",0.190158,Somewhat-Bullish,271.43,266.58,273.555,265.61,4147827.0,92158.0,268.581195
2022-09-27,Dow Jones Falls Into Bear Market; These Stocks Hurt The Index The Most,https://www.investors.com/research/dow-jones-falls-into-bear-market-these-stocks-hurt-the-index-the-most/,Dow Jones Falls Into Bear Market. These Stocks Hurt The Index The Most Investor's Business Daily ...,0.110693,Neutral,269.36,268.69,273.69,266.98,3667832.0,84004.0,269.438691
2022-09-28,"Bullish On The Homebuilding Sector? This 3X Bull ETF Tracks Home Depot, Lowe's - Direxion Daily Homebuilders & Supplies Bull 3X Shares  ( ARCA:NAIL ) ",https://www.benzinga.com/trading-ideas/long-ideas/22/09/29056929/bullish-on-the-homebuilding-sector-this-3x-bull-etf-tracks-home-depot-lowes,Direxion Daily Homebuilders & Supplies Bull 3X Shares NAIL was surging more than 12% higher on Wednesday in an attempt to reverse course from its most recent downtrend that began on Aug. 17. NAIL is a triple-leveraged fund designed to outperform 52 U.S. companies in the home construction sector ...,0.119843,Neutral,275.22,282.19,283.4998,272.71,5766850.0,124997.0,279.295076
2022-09-29,Hurricane Ian Likely to Hurt/Boost These ETF Areas,https://www.zacks.com/stock/news/1986381/hurricane-ian-likely-to-hurtboost-these-etf-areas,Hurricane Ian could prove to be one of the most hazardous storms to hit Florida. The storm could benefit/hurt these ETF areas.,-0.116831,Neutral,278.51,278.33,278.76,274.7342,4493155.0,89980.0,277.216761
2022-09-30,Hurricane Ian: These companies are donating to relief efforts,https://www.foxbusiness.com/lifestyle/hurricane-ian-companies-donating-relief-efforts,"Major corporations are already pledging millions of dollars to help Florida recover after Hurricane Ian, which tied 2004's Hurricane Charley as the fourth-strongest storm to strike the Sunshine State.",0.225423,Somewhat-Bullish,277.82,275.94,281.785,274.76,4759500.0,90479.0,277.868119
2022-10-03,Home Depot Whale Trades Spotted - Home Depot  ( NYSE:HD ) ,https://www.benzinga.com/markets/options/22/10/29122625/home-depot-whale-trades-spotted,"A whale with a lot of money to spend has taken a noticeably bearish stance on Home Depot. Looking at options history for Home Depot HD we detected 17 strange trades. If we consider the specifics of each trade, it is accurate to state that 23% of the investors opened trades with bullish ...",0.151152,Somewhat-Bullish,281.0,283.7,286.06,279.55,3556801.0,79512.0,283.829036
2022-10-05,Hurricane Ian recovery efforts boost ProcureAM's FEMA ETF,https://www.foxbusiness.com/markets/hurricane-ian-recovery-efforts-boost-procuream-fema-etf,An exchange-traded fund launched back in June may offer investors an opportunity to capitalize on Hurricane Ian recovery efforts.,0.10514,Neutral,286.25,289.85,292.11,285.37,2715393.0,59138.0,289.448054
2022-10-06,"Target Stock Down 32% This Year, What's Next?",https://www.forbes.com/sites/greatspeculations/2022/10/06/target-stock-down-32-this-year-whats-next/,"TGT stock has declined from around $232 to near $148 year-to-date, compared to a 26% fall in the S&P index.",0.046257,Neutral,289.56,290.39,292.97,287.775,2603149.0,57651.0,290.518681
2022-10-10,Wilsonart® Expands Retail Availability of its Popular THINSCAPE® Performance Tops,https://www.benzinga.com/pressreleases/22/10/g29201195/wilsonart-expands-retail-availability-of-its-popular-thinscape-performance-tops,"AUSTIN, Texas, Oct. 10, 2022 ( GLOBE NEWSWIRE ) -- Wilsonart, a world-leading engineered surfaces company, announced today that it will expand distribution of its THINSCAPE® Performance Tops collection.",0.393038,Bullish,283.56,282.46,284.86,280.22,2095804.0,52645.0,282.916097
2022-10-11,What Are Whales Doing With Home Depot - Home Depot  ( NYSE:HD ) ,https://www.benzinga.com/markets/options/22/10/29224545/what-are-whales-doing-with-home-depot,"Someone with a lot of money to spend has taken a bullish stance on Home Depot HD. We noticed this today when the big position showed up on publicly available options history that we track here at Benzinga. Whether this is an institution or just a wealthy individual, we don't know.",0.189376,Somewhat-Bullish,281.1,282.89,286.2,280.9,2744451.0,54312.0,283.392826
2022-10-12,4 Inflation Revelations From Home Depot's 12-Foot Skeleton,https://www.forbes.com/sites/jennmcmillen/2022/10/12/4-inflation-revelations-from-home-depots-12-foot-skeleton/,"Home Depot's Halloween phenomenon - a 12-foot lawn skeleton that helped lift consumer isolation from the grave during the pandemic - continues to sell out. So, is there more to Skelly's popularity than timing? Let's unpack what a massive lawn ornament says about consumers today.",0.099755,Neutral,284.42,280.52,284.6425,280.49,2235164.0,50607.0,281.547934
2022-10-13,Looking Into Home Depot's Recent Short Interest - Home Depot  ( NYSE:HD ) ,https://www.benzinga.com/short-sellers/22/10/29259652/looking-into-home-depots-recent-short-interest,"Home Depot's HD short percent of float has fallen 8.6% since its last report. The company recently reported that it has 8.69 million shares sold short, which is 0.85% of all regular shares that are available for trading. Based on its trading volume, it would take traders 2.6 days to cover their ...",0.239316,Somewhat-Bullish,274.66,282.83,284.83,268.7321,3822769.0,84125.0,279.138405
2022-10-14,NOT REAL NEWS: A look at what didn't happen this week,https://apnews.com/article/russia-ukraine-zelenskyy-kyiv-mlb-sports-a0655af50c0ade448e470089c56e5205,"A roundup of some of the most popular but completely untrue stories and visuals of the week. None of these are legit, even though they were shared widely on social media. The Associated Press checked them out. Here are the facts: Russian strikes in Kyiv didn't destroy Zelenskyy's office",-0.021571,Neutral,286.64,276.43,286.64,275.95,2753238.0,62614.0,278.462266
2022-10-17,Halloween spending expected to increase by $500 million - as candy prices soar at the highest rate on record,https://www.marketwatch.com/story/halloween-spending-expected-to-increase-by-500-million-candy-prices-soar-at-the-highest-rate-on-record-11666022021,"The total Halloween spending is to reach $10.6 billion this year, a record number, according to the National Retail Federation ...",0.115733,Neutral,279.6,281.26,283.87,279.34,3408763.0,69226.0,281.74614
2022-10-18,"2 Equity REITs Touting Double-Digit Yields To Fight Inflation - Dollar Gen  ( NYSE:DG ) , Dick's Sporting Goods  ( NYSE:DKS ) ",https://www.benzinga.com/trading-ideas/long-ideas/22/10/29295825/2-equity-reits-touting-double-digit-yields-to-fight-inflation,"Equity real estate investment trusts ( REITs ) have outperformed mortgage REITs, as mortgage real estate investment trusts have posted annualized returns of 8.2% over the past 10 years.",0.21319,Somewhat-Bullish,287.95,285.06,289.86,283.23,3153657.0,61639.0,285.76124
2022-10-19,Could These 3 Stocks Match Home Depot's 350% Returns?,https://www.fool.com/investing/2022/10/19/could-these-3-stocks-match-home-depots-350-returns/,"The home improvement retailer has given its shareholders monster returns over the past decade, so investors are looking for the next Home Depot.",0.3346,Somewhat-Bullish,282.47,275.49,282.765,273.02,4309371.0,82243.0,276.389387
2022-10-20,PPG Industries  ( PPG )  Q3 2022 Earnings Call Transcript,https://www.fool.com/earnings/call-transcripts/2022/10/20/ppg-industries-ppg-q3-2022-earnings-call-transcrip/,"PPG earnings call for the period ending September 30, 2022.",0.246528,Somewhat-Bullish,274.94,269.46,278.0,267.865,3946546.0,72223.0,270.959622
2022-10-21,Deckers  ( DECK )  Lined Up for Q2 Earnings: What's in Store?,https://www.zacks.com/stock/news/1995770/deckers-deck-lined-up-for-q2-earnings-whats-in-store,Deckers' (DECK) second-quarter fiscal 2023 results are likely to reflect strength in the HOKA ONE ONE brand.,0.254651,Somewhat-Bullish,268.34,275.53,275.71,268.0,3408929.0,66359.0,273.032238
2022-10-24,In A Workers' Market What Steps Can Retailers Take Prepare For The Holidays?,https://www.forbes.com/sites/jillstandish/2022/10/24/in-a-workers-market-what-steps-can-retailers-take-prepare-for-the-holidays/,"With the number of global active retail job openings growing by 174% year on year, the need to secure enough motivated front-line retail workers to cover peak seasonal demand is right at the top of the list for retailers.",0.436472,Bullish,276.97,283.26,284.47,276.97,2924383.0,64132.0,281.760607
2022-10-25,"Drip, Drip, Drip: It's a Waiting Game as Investors Look for Direction from Microsoft and Alphabet After Close - Microsoft  ( NASDAQ:MSFT ) ",https://www.benzinga.com/markets/22/10/29402562/drip-drip-drip-its-a-waiting-game-as-investors-look-for-direction-from-microsoft-and-alphabet-after,"( Tuesday Market Open ) The sound you hear is fingers tapping as investors await critical earnings from info tech giants over the next three days, starting with Microsoft MSFT and Alphabet GOOGL this afternoon. Meta Platforms META reports tomorrow afternoon, followed by Apple AAPL and Amazon ...",0.081484,Neutral,285.51,290.26,292.1339,285.51,2784846.0,58442.0,289.95392
2022-10-26,Earnings have been mostly good. Just avoid the tech wreck,https://www.cnn.com/2022/10/26/investing/dow-stock-market-today-earnings/index.html,"New York ( CNN Business ) Stocks have rallied sharply in October, despite continued worries about rampant inflation globally, a strong dollar hurting multinational companies and the political and economic turmoil in the UK. A lot of the optimism has to do with the fact that investors are hoping ...",0.174934,Somewhat-Bullish,290.6,290.15,291.8699,286.168,2593978.0,59718.0,290.063382
2022-10-27,Facebook used to be a Big Tech giant - now Meta isn't even in the top 20 most valuable U.S. companies,https://www.cnbc.com/2022/10/27/meta-is-no-longer-one-of-the-20-biggest-us-companies.html,"Meta shares are down more than 20% on Thursday, the second time this year they've collapsed after an earnings report.",0.081136,Neutral,291.85,291.06,294.27,289.45,3028130.0,61735.0,291.808155
2022-10-28,Stock & ETF Treats for This Halloween,https://www.zacks.com/stock/news/2007624/stock-etf-treats-for-this-halloween,"Per NRF, participation in Halloween-related activities will bounce back to pre-pandemic levels this year.",0.18935,Somewhat-Bullish,290.0,298.65,299.16,290.0,3221646.0,64958.0,296.396848
2022-10-31,Halloween brings more tricks than treats for investors | Business,https://www.cnn.com/2022/10/31/investing/stocks-winners-losers/index.html,Halloween brings more tricks than treats for investors ...,0.022097,Neutral,294.41,296.13,299.28,292.55,4199290.0,69016.0,296.459019
2022-11-01,My Best Dividend Stock to Buy in November,https://www.fool.com/investing/2022/11/01/my-best-dividend-stock-to-buy-in-november/,This passive income machine operates in an industry that will never disappear.,0.560933,Bullish,300.37,296.06,302.21,293.35,3303147.0,62708.0,295.739997
2022-11-02,Good Stocks To Buy Right Now? 3 Consumer Stocks To Watch Today,https://stockmarket.com/featured/good-stocks-to-buy-right-now-3-consumer-stocks-to-watch-today-2022-11-02,"Consumer stocks are a type of stock that represents ownership in a company that sells goods or services to individuals. These companies can be engaged in a wide variety of businesses, from retail and food service to transportation and media.",0.28951,Somewhat-Bullish,295.2,288.73,300.165,288.52,4332968.0,76625.0,292.969882
2022-11-03,Home Depot Unusual Options Activity For November 03 - Home Depot  ( NYSE:HD ) ,https://www.benzinga.com/markets/options/22/11/29550841/home-depot-unusual-options-activity-for-november-03,"A whale with a lot of money to spend has taken a noticeably bearish stance on Home Depot. Looking at options history for Home Depot HD we detected 10 strange trades. If we consider the specifics of each trade, it is accurate to state that 30% of the investors opened trades with bullish ...",0.099316,Neutral,283.57,281.5,285.95,280.5115,4817690.0,95163.0,282.001242
2022-11-04,"It's vacations vs. shopping this holiday season, and travel has the edge",https://www.cnbc.com/2022/11/04/travel-has-edge-over-shopping-holiday-season-amid-inflation.html,The peak shopping season will test spending priorities of consumers who are facing high inflation.,-0.004841,Neutral,285.89,284.03,288.838,277.5,4380043.0,87821.0,282.916519
2022-11-07,"Housing Market Braces For Rising Layoffs 'Soon' As Mortgage Lenders, Home Sellers Cut Thousands Of Jobs",https://www.forbes.com/sites/jonathanponciano/2022/11/07/housing-market-braces-for-rising-layoffs-soon-as-mortgage-lenders-home-sellers-cut-thousands-of-jobs/,"Last week, home-selling platform Opendoor blamed ""one of the most challenging real estate markets in 40 years"" as it laid off 550 workers, and Wells Fargo is reportedly eyeing thousands of job cuts.",-0.189079,Somewhat-Bearish,286.5,290.27,291.6999,282.84,3249983.0,67706.0,288.362482
2022-11-08,"Nominations Are Open For ""Nation's Finest 50""!",https://www.benzinga.com/pressreleases/22/11/n29618495/nominations-are-open-for-nations-finest-50,Nominate People who have Helped Veterans in Need and Celebrate Nation's Finest's 50th,0.411995,Bullish,292.43,291.14,293.34,287.6332,3350886.0,71885.0,290.875538
2022-11-09,Counting the Votes: Gridlock Still Possible but Market Uncertainty Ticks Up as Results Remain Unclear,https://www.benzinga.com/markets/22/11/29643553/counting-the-votes-gridlock-still-possible-but-market-uncertainty-ticks-up-as-results-remain-unclear,"( Wednesday Market Open ) As Republicans and Democrats wrestle for control of the House and Senate after Tuesday's vote, the atmosphere is subdued on Wall Street. Neither party gained obvious control of the Capitol based on results available early this morning, and the market traded nearly ...",0.004856,Neutral,289.0,286.75,292.5,286.26,3049443.0,57713.0,288.393183
2022-11-10,Here's How Home Depot  ( HD )  is Positioned Ahead of Q3 Earnings,https://www.zacks.com/stock/news/2016882/heres-how-home-depot-hd-is-positioned-ahead-of-q3-earnings,"Home Depot (HD) Q3 results are likely to reflect gains from strong demand for home improvement projects, a rise in average ticket and ongoing investments amid high costs.",0.132831,Neutral,297.74,311.7,314.74,297.08,7762078.0,136904.0,309.466663
2022-11-11,"Adobe, Home Depot, TJX And This Energy Play Feature On CNBC's 'Final Trades' - Adobe  ( NASDAQ:ADBE ) , Home Depot  ( NYSE:HD ) ",https://www.benzinga.com/trading-ideas/long-ideas/22/11/29677777/adobe-home-depot-tjx-and-this-energy-play-feature-on-cnbcs-final-trades,"On CNBC's ""Halftime Report Final Trades,"" Brenda Vingiello of Sand Hill Global Advisors said that Adobe Inc's ADBE stock valuation was ""very depressed versus where it trades at historically."" The company's management has ""an excellent track record"" of making acquisitions that ""really add to ...",0.239041,Somewhat-Bullish,312.0,314.94,317.68,310.24,4911650.0,97783.0,314.693616
