date,Article Headline,Article URL,Article Text,overall_sentiment_score,overall_sentiment_label,Stock Open,Stock Close,Stock High,Stock Low,volume,num_trades,adj_close
2022-05-31,Mid-Day Market Update: Nasdaq Turns Positive; Gold Fields Shares Plunge,https://www.benzinga.com/news/earnings/22/05/27479070/mid-day-market-update-nasdaq-turns-positive-gold-fields-shares-plunge,"U.S. stocks pared losses midway through trading, with the Nasdaq Composite turning higher on Tuesday. The Dow traded down 0.18% to 33,154.67 while the NASDAQ rose 0.20% to 12,155.91. The S&P also fell, dropping, 0.12% to 4,153.24. Also check this: Home Depot And 2 Other Stocks Insiders Are Buying Le",-0.045772,Neutral,306.6,302.75,307.8659,300.83,5927587.0,85392.0,303.353114
2022-06-01,Mid-Day Market Update: Dow Dips 200 Points; Tonix Pharmaceuticals Shares Spike Higher,https://www.benzinga.com/news/earnings/22/06/27505195/mid-day-market-update-dow-dips-200-points-tonix-pharmaceuticals-shares-spike-higher,"U.S. stocks traded lower midway through trading, with the Dow Jones dropping more than 200 points on Wednesday. Following the market opening Wednesday, the Dow traded down 0.65% to 32,776.18 while the NASDAQ fell 0.29% to 12,045.95. The S&P also fell, dropping, 0.65% to 4,105.43. Also check this: Ho",-0.026592,Neutral,301.74,297.19,302.98,297.03,3046914.0,63600.0,298.603596
2022-06-02,Mid-Day Market Update: U.S. Stocks Turn Positive; Nasdaq Jumps 150 Points,https://www.benzinga.com/news/earnings/22/06/27527478/mid-day-market-update-u-s-stocks-turn-positive-nasdaq-jumps-150-points,"U.S. stocks turned higher midway through trading, with the Nasdaq Composite gaining 150 points on Thursday. The Dow traded up 0.24% to 32,891.92 while the NASDAQ rose 1.25% to 12,144.76. The S&P also rose, gaining, 0.65% to 4,127.86. Also check this: Home Depot And 2 Other Stocks Insiders Are Buying",-0.008717,Neutral,298.81,305.87,306.03,295.8933,4046861.0,71785.0,301.908228
2022-06-03,Why RH Sees Softer Demand Ahead,https://www.barrons.com/articles/rh-had-strong-earnings-the-home-goods-retailer-still-sees-demand-softening-51654271861,"RH is wobbling on Friday, after the home goods retailer provided a cautious outlook for the year. After the close of regular trading Thursday RH ( ticker: RH ) said it earned $7.78 a share, on revenue that rose 11.2% year over year to $957 million. Consensus called for EPS of $5.33 on revenue ...",0.097238,Neutral,303.33,305.08,308.46,301.9,2564239.0,59876.0,305.349448
2022-06-06,Home Depot Makes Wells Fargo List of Favored Retail Stocks,https://www.thestreet.com/investing/homedepot-retail-stock-picks-wells-fargo,The S&P Retail Select Industry Index has dropped 27% year to date. But Wells Fargo analysts see some opportunities.,-0.114671,Neutral,305.56,303.89,307.613,303.25,2539461.0,53540.0,304.867071
2022-06-07,Mid-Day Market Update: Nasdaq Turns Higher; REV Group Shares Plunge,https://www.benzinga.com/news/earnings/22/06/27592795/mid-day-market-update-nasdaq-turns-higher-rev-group-shares-plunge,"U.S. stocks pared losses, with the Nasdaq Composite turning higher midway through trading on Tuesday. The Dow traded down 0.04% to 32,901.22 while the NASDAQ rose 0.11% to 12,074.97. The S&P also fell, dropping, 0.01% to 4,121.38. Also check this: Home Depot And 2 Other Stocks Insiders Are Buying Le",-0.021605,Neutral,295.06,301.77,302.38,292.6,3531653.0,67329.0,298.76207
2022-06-08,"RH, Petco, and 4 Other Retail Stocks for a Volatile Market",https://www.barrons.com/articles/rh-petco-and-4-other-stocks-that-are-good-picks-as-investors-fret-about-a-market-downturn-51654702777,"To say that the retail sector has been volatile in recent weeks is an understatement. Yet it goes without saying that investors are concerned about more than Target's need to discount T-shirts. Given the importance of consumer spending for the economy, the upheaval reflects overall anxiety about ...",-0.093513,Neutral,299.78,297.53,300.58,295.6823,2661873.0,59428.0,298.160933
2022-06-09,3 Blue-Chip Dividend Stocks to Buy on the Dip,https://www.fool.com/investing/2022/06/09/3-blue-chip-dividend-stocks-to-buy-on-the-dip/,You can buy and forget about these investments.,0.17936,Somewhat-Bullish,297.76,299.86,306.88,297.35,4156413.0,84022.0,302.920705
2022-06-10,The Fed's Attempts To Combat Inflation Aren't Working As May CPI Grows By 1%,https://www.benzinga.com/news/earnings/22/06/27650289/the-feds-attempts-to-combat-inflation-arent-working-as-may-cpi-grows-by-1,( Friday Market Open ) Thursday's selloff continued for equity futures on Friday morning as the widely awaited May Consumer Price Index ( CPI ) numbers came in worse than expected before the open.,-0.378808,Bearish,291.5,289.24,296.5,288.64,4594066.0,90818.0,290.983222
2022-06-13,$26 billion warehousing deal,https://www.axios.com/pro/retail-deals/2022/06/13/prologis-duke-realty-buy-26-billion-deal,Prologis buys Duke Realty in $26 billion deal ...,0.03335,Neutral,284.36,283.16,286.82,281.2801,4630784.0,95952.0,283.348125
2022-06-14,Best Buy downgraded as consumers tighten their belts amid high inflation,https://www.marketwatch.com/story/best-buy-downgraded-as-consumers-tighten-their-belts-amid-high-inflation-11655222144,Bank of America downgraded Best Buy and upgraded Tractor Supply as inflation shifts consumer spending to essentials and away from discretionary items.,-0.108032,Neutral,283.21,278.67,286.3803,276.59,3971240.0,86197.0,279.913516
2022-06-15,Should You Build Your Portfolio Around This Home Improvement Dividend Stock?,https://www.fool.com/investing/2022/06/15/should-you-build-around-this-home-dividend-stock/,Home Depot is the most dominant home improvement retailer in the world.,0.173781,Somewhat-Bullish,281.0,279.73,283.59,275.47,3952207.0,83257.0,279.758171
2022-06-16,Home Depot  ( HD )  Down 1.9% Since Last Earnings Report: Can It Rebound?,https://www.zacks.com/stock/news/1939945/home-depot-hd-down-19-since-last-earnings-report-can-it-rebound,Home Depot (HD) reported earnings 30 days ago. What's next for the stock? We take a look at earnings estimates for some clues.,0.063733,Neutral,274.92,273.46,276.1084,269.73,6146389.0,118237.0,272.76285
2022-06-17,Ken Langone warns of 'serious recession' after Fed 'disappointment' on inflation,https://www.foxbusiness.com/economy/ken-langone-warns-serious-recession-fed-disappointment-inflation,"During an interview on ""Mornings with Maria"" Friday, Home Depot co-founder Ken Langone issued a gloomy prediction for the U.S. economy, Friday, arguing the country will face a ""serious recession"" as record inflation continues. KEN LANGONE: We've got all kinds of dislocations in the economy.",-0.355612,Bearish,271.0,270.73,276.62,270.39,10736036.0,92960.0,271.478811
2022-06-21,3 Dividend Stocks You Can Safely Hold for Decades,https://www.fool.com/investing/2022/06/21/3-dividend-stocks-you-can-safely-hold-for-decades/,"The market looks shaky, but these winners are solid picks.",0.156399,Somewhat-Bullish,273.69,269.2,273.92,267.42,5475334.0,113463.0,270.093292
2022-06-22,10 Stocks to Buy When They're Down,https://www.kiplinger.com/investing/stocks/value-stocks/604826/stocks-to-buy-when-they-are-down,"When you buy shares of stock, you become a partner in a business. Perhaps I'm stating the obvious, but I doubt all investors see their purchases that way. Many see stocks as horses to bet on or as scorecards that tell them how their 401 ( k ) is doing.",-0.140411,Neutral,266.39,268.98,271.77,264.51,4660577.0,80946.0,268.90197
2022-06-23,"Home Improvement Retailers Are Still Winning With Analysts, to an Extent",https://www.barrons.com/articles/home-improvement-retailers-stocks-outlook-51655997546,"The current state of the economy is a bit like a choose-your-own-adventure book. Think that the doom and gloom is overstated? Wrap yourself in the blanket of a tight labor market, rising wages, and Americans' high savings and low delinquency rates. Worried the worst has yet to come?",-0.115744,Neutral,270.0,275.42,275.59,269.89,3693314.0,69216.0,273.232233
2022-06-24,Jill Zarin heads back to 'Housewives' after building business empire: 'It was like I never left',https://www.foxbusiness.com/lifestyle/jill-zarin-back-housewives-building-multi-million-dollar-empire,"Jill Zarin has always had business on the brain, and it comes as no surprise she's almost completely evaded camera crews through the years despite being an original Real Housewife of New York.",0.23402,Somewhat-Bullish,277.47,283.0,283.46,273.92,10249737.0,76784.0,282.332564
2022-06-27,"Material Bank Wins Prestigious 2022 Adobe Experience Maker ""The Disruptor"" Award",https://www.benzinga.com/pressreleases/22/06/g27863138/material-bank-wins-prestigious-2022-adobe-experience-maker-the-disruptor-award,"NEW YORK, June 27, 2022 ( GLOBE NEWSWIRE ) -- The Adobe Experience Maker Awards has named Material Bank, the world's largest marketplace for architectural, design, and construction materials, as the winner in The Disruptor category of its 2022 awards program, designed to recognize individuals, ...",-0.020714,Neutral,284.46,282.69,285.0,281.49,2519578.0,57887.0,283.013779
2022-06-28,Check Out What Whales Are Doing With Home Depot,https://www.benzinga.com/markets/options/22/06/27887103/check-out-what-whales-are-doing-with-home-depot,"Someone with a lot of money to spend has taken a bullish stance on Home Depot HD. We noticed this today when the big position showed up on publicly available options history that we track here at Benzinga. Whether this is an institution or just a wealthy individual, we don't know.",-0.03274,Neutral,283.78,270.15,285.6,269.82,4049129.0,85964.0,274.385297
2022-06-29,"$1000 Invested In This Stock 10 Years Ago Would Be Worth $5,200 Today",https://www.benzinga.com/news/earnings/22/06/27903745/1000-invested-in-this-stock-10-years-ago-would-be-worth-5-200-today,"Home Depot HD has outperformed the market over the past 10 years by 7.43% on an annualized basis producing an average annual return of 18.15%. Currently, Home Depot has a market capitalization of $281.32 billion.",0.011885,Neutral,271.58,273.87,276.16,268.805,2165600.0,56873.0,273.699451
2022-06-30,"GOP megadonors turn on Trump after Jan. 6 hearings, set sights on DeSantis, Pence and other 2024 hopefuls",https://www.cnbc.com/2022/06/30/gop-megadonors-turn-on-trump-look-for-2024-alternatives-after-jan-6-hearings.html,Republican megadonors are moving further away from Donald Trump and moving to consider other potential 2024 contenders after the latest Jan. 6 hearings.,-0.788334,Bearish,270.73,274.27,277.04,268.04,4028233.0,74122.0,273.647688
2022-07-01,What Are Whales Doing With Home Depot,https://www.benzinga.com/markets/options/22/07/27933139/what-are-whales-doing-with-home-depot,"Someone with a lot of money to spend has taken a bullish stance on Home Depot HD. We noticed this today when the big position showed up on publicly available options history that we track here at Benzinga. Whether this is an institution or just a wealthy individual, we don't know.",-0.033247,Neutral,275.73,279.08,280.75,274.55,2793981.0,59562.0,277.909247
2022-07-05,3 Reasons to Buy Shopify Stock,https://www.fool.com/investing/2022/07/05/3-reasons-to-buy-shopify-stock/,"Right now, Shopify's discounted stock looks more like a bargain buy than a value trap.",0.06297,Neutral,275.5,283.73,283.73,275.03,3224176.0,63731.0,280.898386
2022-07-06,Why Lowe's Stock Is Down 32% So Far in 2022,https://www.fool.com/investing/2022/07/06/why-lowes-stock-is-down-32-so-far-in-2022/,The housing market is due for a pullback.,-0.244022,Somewhat-Bearish,284.99,283.58,285.9212,280.52,2184509.0,53749.0,283.295981
2022-07-07,Got $500? 3 Cheap Stocks to Buy Right Now,https://www.fool.com/investing/2022/07/07/got-500-3-cheap-stocks-to-buy-right-now/,You don't need a ton of money to benefit from the cheap stocks in this market.,-0.035101,Neutral,282.84,286.69,286.97,281.45,3118844.0,63011.0,285.096056
2022-07-08,Why Home Depot  ( HD )  is a Top Value Stock for the Long-Term,https://www.zacks.com/stock/news/1949775/why-home-depot-hd-is-a-top-value-stock-for-the-long-term,"Whether you're a value, growth, or momentum investor, finding strong stocks becomes easier with the Zacks Style Scores, a top feature of the Zacks Premium research service.",0.14153,Neutral,285.99,286.47,287.99,283.91,1877585.0,42095.0,286.117847
2022-07-11,Barron's Picks Three Retail Leaders,https://www.forbes.com/sites/walterloeb/2022/07/11/barrons-picks-three-retail-leaders/,Barron's picked three retail leaders among 24 top CEO's whose recent action has strengthened their companies and made them more competitive.,0.315453,Somewhat-Bullish,285.18,286.39,289.59,285.14,2411883.0,55880.0,287.486112
2022-07-12,Metaverse - Revolutionizing How Consumers Shop,https://www.forbes.com/sites/roomykhan/2022/07/12/metaverserevolutionizing-how-consumers-shop/,"The Metaverse, through Virtual Reality (VR) and Augmented Reality (AR) technologies, is harbingering new economic opportunities, transcending digital and physical worlds, across a multitude of industries.",0.243697,Somewhat-Bullish,288.97,285.12,293.6423,283.4101,2686366.0,63069.0,288.006763
2022-07-13,Stock Market Bounces Despite Red-Hot Inflation Report; Bank Earnings On Tap,https://www.investors.com/market-trend/stock-market-today/stock-market-bounces-red-hot-inflation-bank-earnings/,Stock Market Bounces Despite Red-Hot Inflation Report. Bank Earnings On Tap Investor's Business Daily ...,-0.058082,Neutral,281.63,287.18,289.79,279.76,2917782.0,55170.0,286.607651
2022-07-14,"Short Straddle Using Goldman Sachs Stock Could Generate $1,615 In Option Premium",https://www.investors.com/research/options/goldman-sachs-stock-short-straddle-could-generate-1615-in-option-premium/,Short Straddle Using Goldman Sachs Stock Could Generate $1615 In Option Premium Investor's Business Daily ...,0.007277,Neutral,281.85,289.48,290.29,281.65,2799425.0,58213.0,286.562816
2022-07-15,New 6-FT Animated Ooogie Boogie Joins Cast Of Anamatronic Characters From The Nightmare Before Christmas,https://www.benzinga.com/pressreleases/22/07/n28084361/new-6-ft-animated-ooogie-boogie-joins-cast-of-anamatronic-characters-from-the-nightmare-before-chr,"DALLAS, July 15, 2022 /PRNewswire/ -- Known for its life-size animatronics, Gemmy Industries is thrilled to introduce a new 6-ft animated Oogie Boogie from Tim Burton's beloved The Nightmare Before Christmas. Available exclusively online and in-store at Home Depot, Oogie Boogie is a must-have for ...",0.271085,Somewhat-Bullish,294.81,292.41,295.4522,290.95,2633580.0,55578.0,292.706133
2022-07-18,Google's stock just got a lot cheaper for average investors,https://www.cnn.com/2022/07/18/investing/google-alphabet-stock-split,Google's stock just got a lot cheaper ...,0.164929,Somewhat-Bullish,297.25,293.05,298.49,292.0,2649183.0,60915.0,294.784365
2022-07-19,How To Use Options To Buy This Dow Jones Stock,https://www.investors.com/research/options/ko-stock-available-at-a-discount-with-options/,KO Stock Available At A Discount With Options Investor's Business Daily ...,0.002446,Neutral,295.44,299.83,300.01,293.3101,2603866.0,57377.0,298.180862
2022-07-20,Apple To $185? Plus This Analyst Lowers Price Target On Amazon.com,https://www.benzinga.com/news/22/07/28134696/apple-to-185-plus-this-analyst-lowers-price-target-on-amazon-com,"Jefferies cut the price target on Amazon.com, Inc. AMZN from $163 to $150. However, Jefferies analyst Brent Thill maintained a Buy rating on the stock. Amazon shares rise 2.5% to trade at $121.19 on Wednesday. Wells Fargo cut the price target on Apple Inc. AAPL from $205 to $185.",0.004832,Neutral,300.93,302.3,303.69,298.28,2516308.0,54159.0,301.832983
2022-07-21,"Stock Market Today: Dow Jones, S&P 500 Tumble On Worse-Than-Expected Data; Tesla Gains Following Earnings Report",https://stockmarket.com/featured/stock-market-today-dow-jones-sp-500-tesla-gains-following-earnings-report-2022-07-21,"Markets open mixed on Thursday on worse-than-anticipated jobless claims & manufacturing data. The post Stock Market Today: Dow Jones, S&P 500 Tumble On Worse-Than-Expected Data. Tesla Gains Following Earnings Report appeared first on Stock Market News, Quotes, Charts and Financial Information | ...",0.125982,Neutral,302.85,305.0,305.25,298.87,1950798.0,46658.0,303.051382
2022-07-22,Ladies Who Launch Announces 2022 Women & Non-Binary-Owned Small Businesses Grants,https://www.prnewswire.com/news-releases/ladies-who-launch-announces-2022-women--non-binary-owned-small-businesses-grants-301591744.html,"Initially founded to provide immediate relief in the wake of COVID-19, now in its third year, the Program continues to support women and non-binary business owners to overcome barriers to scaling and sustainability.",0.38644,Bullish,307.66,306.59,310.67,304.3609,2380001.0,53345.0,307.107475
2022-07-25,Crypto Price Check: House Committee Expected to Push Stablecoin Bill,https://www.thestreet.com/investing/crypto-price-check-house-committee-expected-to-push-stablecoin-bill,"A House committee this week is expected to advance a bill on stablecoins, while analysts say high-profile cases may spur crypto-rule-making.",-0.023813,Neutral,306.8,306.15,307.4299,303.83,1900284.0,45206.0,305.569984
2022-07-26,Looking At Home Depot's Recent Whale Trades,https://www.benzinga.com/markets/options/22/07/28208482/looking-at-home-depots-recent-whale-trades,"A whale with a lot of money to spend has taken a noticeably bearish stance on Home Depot. Looking at options history for Home Depot HD we detected 10 strange trades. If we consider the specifics of each trade, it is accurate to state that 40% of the investors opened trades with bullish ...",0.080768,Neutral,297.0,298.18,300.635,295.91,2683401.0,60033.0,297.987301
2022-07-27,"Stock Market Today: Dow Jones, S&P 500, & Nasdaq Rally Ahead Of FOMC Meeting",https://stockmarket.com/featured/stock-market-today-dow-jones-sp-500-nasdaq-rally-ahead-of-fomc-meeting-2022-07-27,"On Wednesday, the Dow Jones Industrial Average is up over 141 points. This comes on the heels of big tech earnings from companies like Alphabet ( NASDAQ: GOOGL ) and Microsoft. As well as, investors waiting anxiously to see what the Federal Reserve will do with interest rates this time around.",0.189965,Somewhat-Bullish,298.21,298.91,300.31,291.79,3190439.0,63473.0,297.031741
2022-07-28,"Enviro-Log Company Announces New Wax Box Recycling and Firelog Manufacturing Facility in Glendale, Arizona",https://www.benzinga.com/pressreleases/22/07/g28251941/enviro-log-company-announces-new-wax-box-recycling-and-firelog-manufacturing-facility-in-glendale-,"GLENDALE, Ariz., July 28, 2022 ( GLOBE NEWSWIRE ) -- Enviro-Log Company, LLC, a leading eco-friendly, consumer products and recycling company is pleased to announce that it will open a new recycling and manufacturing facility in Glendale, Arizona this summer. Located at 7676 N.",0.182208,Somewhat-Bullish,295.0,299.63,301.24,293.165,3992053.0,81517.0,298.753965
2022-07-29,"A Reese's Peanut Butter Cup shortage? Hershey won't meet Halloween candy demand, CEO warns",https://www.marketwatch.com/story/a-reeses-peanut-butter-cup-shortage-hershey-wont-meet-halloween-candy-demand-ceo-warns-11659109992,"Hershey warned it won't 'fully meet consumer demand' for Halloween, so trick-or-treaters may not find Reese's, Hershey's Kisses and Kit Kat bars this year ...",0.115531,Neutral,300.0,300.94,301.435,297.43,3229655.0,63684.0,299.748265
2022-08-01,$100 Invested In Home Depot 10 Years Ago Would Be Worth This Much Today,https://www.benzinga.com/news/earnings/22/08/28293430/100-invested-in-home-depot-10-years-ago-would-be-worth-this-much-today,"Home Depot HD has outperformed the market over the past 10 years by 7.94% on an annualized basis producing an average annual return of 19.33%. Currently, Home Depot has a market capitalization of $315.31 billion.",0.160819,Somewhat-Bullish,300.64,305.82,308.45,300.01,3286477.0,67340.0,305.832075
2022-08-02,Why Home Depot  ( HD )  is Poised to Beat Earnings Estimates Again,https://www.zacks.com/stock/news/1962326/why-home-depot-hd-is-poised-to-beat-earnings-estimates-again,Home Depot (HD) has an impressive earnings surprise history and currently possesses the right combination of the two key ingredients for a likely beat in its next quarterly report.,0.340724,Somewhat-Bullish,305.4,300.71,305.61,300.01,3076196.0,64345.0,302.176197
2022-08-03,"Stock Market Today: Dow Jones, S&P 500 Rebound Following Back To Back Losing Days",https://stockmarket.com/featured/stock-market-today-dow-jones-sp-500-rebound-following-back-to-back-losing-days-2022-08-03,"U.S. stock futures are trading higher early Wednesday morning. This comes on the heels of new economic data getting released on Wednesday morning. Additionally, investors await data from more notable names in the stock market on Wednesday.",0.284276,Somewhat-Bullish,303.35,306.37,308.07,300.34,3320567.0,64726.0,305.353666
2022-08-04,Tecnoglass  ( TGLS )  Q2 Earnings and Revenues Top Estimates,https://www.zacks.com/stock/news/1963999/tecnoglass-tgls-q2-earnings-and-revenues-top-estimates,"Tecnoglass (TGLS) delivered earnings and revenue surprises of 21.05% and 12.90%, respectively, for the quarter ended June 2022. Do the numbers hold clues to what lies ahead for the stock?",0.158001,Somewhat-Bullish,304.54,307.17,309.97,304.44,2714500.0,58073.0,307.326751
2022-08-05,"The best sales to shop today: Tushy, Therabody, Beats and more",https://www.cnn.com/2022/08/05/cnn-underscored/deals/best-online-sales-right-now,"The best sales to shop this weekend: Tushy, Therabody, Beats and more ...",0.41515,Bullish,305.38,309.69,309.78,304.495,2025483.0,47122.0,307.692166
2022-08-08,"Stock Market Today: Dow Jones, S&P 500 Rally; Nvidia Falls Following Revenue Warning",https://stockmarket.com/featured/stock-market-today-dow-jones-sp-500-nvidia-falls-following-revenue-warning-2022-08-08,"All major stock market indices opened green to start the trading week. The post Stock Market Today: Dow Jones, S&P 500 Rally. Nvidia Falls Following Revenue Warning appeared first on Stock Market News, Quotes, Charts and Financial Information | StockMarket.com.",0.131787,Neutral,311.86,311.97,315.8,310.44,2496511.0,62734.0,312.639678
2022-08-09,3 Safe Dividend Stocks Set To Outperform the S&P 500,https://www.fool.com/investing/2022/08/09/3-safe-dividend-stocks-set-to-outperform-the-sp-50/,These stocks can offer generous dividend yields with safety to boot.,0.339152,Somewhat-Bullish,308.89,305.21,309.959,303.31,2602398.0,62945.0,305.251931
2022-08-10,Factors Likely to Influence Home Depot's  ( HD )  Earnings in Q2,https://www.zacks.com/stock/news/1966757/factors-likely-to-influence-home-depots-hd-earnings-in-q2,Home Depot's (HD) Q2 results are expected to reflect continued gains from demand for home improvement projects and ongoing investments amid rising costs due to supply-chain disruptions.,0.238625,Somewhat-Bullish,309.5,311.58,312.98,309.05,3849437.0,72171.0,311.203469
2022-08-11,This Option Trade Profits From An Expected Earnings Reaction In Home Depot Stock,https://www.investors.com/research/options/this-option-trade-profits-from-an-expected-earnings-reaction-in-home-depot-stock/,Home Depot ( HD ) is sitting right between the 50- and 200-day moving averages and is set to report earnings on Tuesday. Home Depot stock has stayed within the expected range following three of the last six earnings announcements.,0.066726,Neutral,313.84,310.69,314.62,309.58,2438677.0,57182.0,311.481145
2022-08-12,"Home Depot Stock, WMT Stock Headline Busy Week Of Retail Earnings; Tech Giants Cisco, Synopsys Also On Deck",https://www.investors.com/home-depot-stock-wmt-stock-headline-busy-week-retail-earnings-tech-giants-cisco-systems/,"Home Depot Stock, WMT Stock Headline Busy Week Of Retail Earnings. Tech Giants Cisco, Synopsys Also On Deck Investor's Business Daily ...",0.12236,Neutral,312.61,314.89,314.93,310.18,2266045.0,49086.0,313.281871
2022-08-15,Shopping For A Rally,https://www.forbes.com/sites/jjkinahan/2022/08/15/shopping-for-a-rally/,"Retail sales, investment and industrial output were all weaker than expected. however, it's worth noting stringent lockdowns in China to combat Covid may have contributed to the disappointing number.",-0.155925,Somewhat-Bearish,312.04,314.61,315.76,310.15,3914061.0,85703.0,313.773802
2022-08-16,3 takeaways from the Investing Club's 'Morning Meeting' on Tuesday,https://www.cnbc.com/2022/08/16/3-takeaways-from-the-investing-clubs-morning-meeting-on-tuesday.html,"The Investing Club hosts its ""Morning Meeting"" every weekday at 10:20 a.m. ET.",0.230189,Somewhat-Bullish,312.98,327.38,332.98,312.88,10076712.0,181946.0,325.939576
2022-08-17,Dow Falls 250 Points; Lowe's Posts Upbeat Earnings,https://www.benzinga.com/news/earnings/22/08/28538279/dow-falls-250-points-lowes-posts-upbeat-earnings,"U.S. stocks traded lower midway through trading, with the Dow Jones dropping 250 points on Wednesday. The Dow traded down 0.75% to 33,897.14 while the NASDAQ fell 1.59% to 12,894.13. The S&P also fell, dropping, 0.99% to 4,262.67.",0.076653,Neutral,328.09,325.76,329.5,324.07,3150599.0,77363.0,326.573135
2022-08-18,"Home Depot and Lowe's cite strong demand in earnings reports, but softening could be ahead",https://www.cnbc.com/2022/08/18/home-depot-and-lowes-cite-strong-demand-but-softening-could-be-ahead.html,"Even as homebuilder sentiment dropped, Home Depot and Lowe's saw continued strong demand from contractors.",0.142596,Neutral,324.96,325.21,327.9399,322.22,2895925.0,64436.0,324.629927
2022-08-19,"Market Rally Pulls Back; Walmart, Target, BBBY Stock In Focus: Weekly Review",https://www.investors.com/news/market-rally-pulls-back-walmart-target-bbby-stock-in-focus/,"Market Rally Pulls Back. Walmart, Target, BBBY Stock In Focus: Weekly Review Investor's Business Daily ...",-0.041759,Neutral,324.97,321.32,326.32,319.775,3482969.0,69316.0,322.423254
