date,Article Headline,Article URL,Article Text,overall_sentiment_score,overall_sentiment_label,Stock Open,Stock Close,Stock High,Stock Low,volume,num_trades,adj_close
2022-11-14,These 3 Dow Stocks Will Make or Break the Market This Week,https://www.fool.com/investing/2022/11/14/these-3-dow-stocks-will-make-or-break-the-market-t/,Where does Wall Street go from here?,0.187146,Somewhat-Bullish,314.36,306.92,315.98,306.34,6378893.0,109362.0,310.22546
2022-11-15,PPI Comes in Lower Than Expected,https://www.zacks.com/stock/news/2018487/ppi-comes-in-lower-than-expected,"The monthly Producer Price Index ( PPI ) - the sister report to last week's Consumer Price Index ( CPI ) which posted positive surprises that led to the best single day of trading in two years - for October is out this morning, and it continues the narrative that inflation is provably past peak ...",0.174829,Somewhat-Bullish,304.06,311.93,316.63,303.25,9255365.0,142826.0,309.921118
2022-11-16,Stock Market Falls On Weak Holiday Outlook Despite Strong Retail Sales,https://www.investors.com/market-trend/stock-market-today/stock-market-falls-on-weak-holiday-outlook-despite-strong-retail-sales/,The stock market fell Wednesday morning after stronger-than-expected October retail sales data. A mixed Q3 report and dour holiday sales outlook from Target ( TGT ) put a damper on stocks. The Nasdaq composite fell 1.4% and the S&P 500 dropped 0.5%. The Dow Jones Industrial Average was flat.,-0.126272,Neutral,305.86,314.91,316.41,304.51,5210257.0,91548.0,313.646103
2022-11-17,Looking Into Home Depot's Recent Short Interest - Home Depot  ( NYSE:HD ) ,https://www.benzinga.com/short-sellers/22/11/29766645/looking-into-home-depots-recent-short-interest,"Home Depot's HD short percent of float has fallen 3.9% since its last report. The company recently reported that it has 7.62 million shares sold short, which is 0.74% of all regular shares that are available for trading. Based on its trading volume, it would take traders 2.1 days to cover their ...",0.239316,Somewhat-Bullish,312.0,311.44,313.68,306.15,3613660.0,73548.0,309.897448
2022-11-18,"Deere Stock, Analog Devices Hold Gains Amid Bullish Earnings Prospects; Baidu, Autodesk Also Set To Report",https://www.investors.com/research/earnings-preview/deere-stock-analog-devices-trade-bullishly-earnings-baidu-autodesk/,"Deere Stock, Analog Devices Hold Gains Amid Bullish Earnings Prospects. Baidu, Autodesk Also Set To Report Investor's Business Daily ...",0.062557,Neutral,314.14,313.18,316.0,310.26,3529729.0,58928.0,312.781936
2022-11-21,Best Consumer Discretionary Stocks to Buy in 2023,https://www.thestreet.com/market-sectors/consumer-discretionary,"Everything investors need to know about owning consumer discretionary stocks, including five top stocks to consider investing in long-term.",0.264999,Somewhat-Bullish,316.96,316.78,318.84,314.2,4049773.0,78550.0,316.477952
2022-11-22,Spruce up your home with the best Black Friday furniture deals,https://www.cnn.com/cnn-underscored/deals/black-friday-furniture-deals-2022,Want more deals? Visit CNN Underscored's Guide to Black Friday for wall-to-wall coverage of the best discounts to be found during the biggest shopping event of the year.,0.326167,Somewhat-Bullish,320.0,324.88,326.82,319.38,6041238.0,103578.0,324.76379
2022-11-23,ETFs in Focus Post Better Q3 Retail Earnings,https://www.zacks.com/stock/news/2021480/etfs-in-focus-post-better-q3-retail-earnings,The overall Q3 earnings picture for the retail sector has improved somewhat from the prior quarter.,0.106244,Neutral,326.76,321.51,327.82,320.44,4219931.0,74298.0,323.372247
2022-11-25,"Amid Blistering Growth, Snowflake Stock Climbs Off Lows Ahead Of Earnings; Retailers FIVE, ULTA, DG Also Set To Report",https://www.investors.com/research/earnings-preview/snowflake-stock-climbs-off-lows-earnings-retailers-five-ulta-dg-also-report/,"Amid Blistering Growth, Snowflake Stock Climbs Off Lows Ahead Of Earnings. Retailers FIVE, ULTA, DG Also Set To Report Investor's Business Daily ...",0.091207,Neutral,322.89,326.38,329.075,321.9,3392768.0,61087.0,326.803773
2022-11-28,Home Depot Unusual Options Activity For November 28 - Home Depot  ( NYSE:HD ) ,https://www.benzinga.com/markets/options/22/11/29874351/home-depot-unusual-options-activity-for-november-28,"Someone with a lot of money to spend has taken a bearish stance on Home Depot HD. We noticed this today when the big position showed up on publicly available options history that we track here at Benzinga. Whether this is an institution or just a wealthy individual, we don't know.",0.164855,Somewhat-Bullish,325.06,318.92,328.8,317.846,4730961.0,82158.0,321.816121
2022-11-29,"EXCLUSIVE: Is Crypto Just For Speculation? More Americans Use Crypto For Purchases Than You May Think - Bitcoin  ( BTC/USD ) , Ethereum  ( ETH/USD ) ",https://www.benzinga.com/markets/cryptocurrency/22/11/29884102/exclusive-is-crypto-just-for-speculation-more-americans-use-crypto-for-purchases-than-you-,"Cryptocurrencies like Bitcoin BTC/USD and Ethereum ETH/USD have appreciated by more than 1200 times since the end of 2012. Yet, it isn't hard to find crypto-bashing content on the internet today, with many believing that cryptocurrencies have no intrinsic value as they are not useful for everyday ...",0.061552,Neutral,316.0,315.96,320.0,315.62,3501117.0,75165.0,317.202574
2022-11-30,3 Dow 30 Stocks To Buy Now According To Analysts,https://stockmarket.com/featured/3-dow-30-stocks-to-buy-now-according-to-analysts-2022-11-30,"The Dow 30, also known as the Dow Jones Industrial Average, is a stock market index that tracks the performance of 30 large companies listed on the Dow Jones Stock Exchange. What's more, the Dow Jones is one of the most closely watched stock market indices in the world.",0.202322,Somewhat-Bullish,312.93,323.99,324.19,311.495,15069772.0,91724.0,322.214623
2022-12-01,Retail Media Networks Are The Next Big Advertising Channel,https://www.forbes.com/sites/bradadgate/2022/12/01/retail-media-networks-are-the-next-big-advertising-channel/,Retail Media Networks are forecast for significant growth in the years ahead. Becoming a strong revenue source for retailers and a valuable component in ad advertisers marketing mix.,0.250837,Somewhat-Bullish,326.31,327.07,329.67,324.44,3822657.0,76738.0,327.181968
2022-12-02,"Sellers Slam Costco Stock Ahead Of Earnings; Lululemon, Ollie's Bargain Outlet, Broadcom Also Set To Report",https://www.investors.com/research/earnings-preview/costco-stock-slammed-ahead-of-earnings-lululemon-ollies-bargain-outlet-broadcom-set-to-report/,"Sellers Slam Costco Stock Ahead Of Earnings. Lululemon, Ollie's Bargain Outlet, Broadcom Also Set To Report Investor's Business Daily ...",0.135896,Neutral,321.08,327.99,328.48,320.33,3636440.0,62775.0,325.778524
2022-12-05,American Cancer Society Adds Four New Members to Its Board of Directors,https://www.prnewswire.com/news-releases/american-cancer-society-adds-four-new-members-to-its-board-of-directors-301694711.html,"Brian Marlow to Serve as Chair of the Board ATLANTA, Dec. 5, 2022 /PRNewswire/ -- The American Cancer Society ( ACS ) has named four new members to its board of directors, with all terms beginning on January 1, 2023. The ACS Board of Directors consists of 22 members, which includes five ...",0.167212,Somewhat-Bullish,325.15,320.08,325.52,319.54,5053996.0,73675.0,321.596113
2022-12-06,Toll Brothers Earnings Preview: Key Support Must Hold on a Dip,https://www.thestreet.com/investing/stocks/toll-brothers-earnings-preview-key-support-must-hold-on-a-dip,Toll Brothers stock will be in focus on Tuesday evening when it reports earnings. Here are the key levels to know right now.,0.071771,Neutral,319.64,317.45,321.65,314.54,3336983.0,70992.0,317.510071
2022-12-07,"Walmart Thefts Are On The Rise, But Your Portfolio Doesn't Have To Take The Hit, Too",https://www.forbes.com/sites/qai/2022/12/07/walmart-thefts-are-on-the-rise/,"Walmart CEO Dough McMillon reports that retail theft is rising at the chain's U.S. stores. Here's how it's taking a toll, and what it could mean for investors.",-0.179769,Somewhat-Bearish,315.96,320.15,322.877,314.44,4022852.0,70933.0,319.719568
2022-12-08,Home Depot Unusual Options Activity For December 08 - Home Depot  ( NYSE:HD ) ,https://www.benzinga.com/markets/options/22/12/30009825/home-depot-unusual-options-activity-for-december-08,"A whale with a lot of money to spend has taken a noticeably bearish stance on Home Depot. Looking at options history for Home Depot HD we detected 19 strange trades. If we consider the specifics of each trade, it is accurate to state that 42% of the investors opened trades with bullish ...",0.146798,Neutral,318.55,324.09,324.525,318.55,3480828.0,65597.0,323.082801
2022-12-09,Best Cyclical Stocks To Buy Now? 2 To Watch,https://stockmarket.com/featured/best-cyclical-stocks-to-buy-now-2-to-watch-2022-12-09,"Cyclical stocks are stocks that tend to rise and fall with the economy. These stocks are typically tied to industries that produce goods or services that are sensitive to changes in economic growth. For example, companies in the automotive, housing, and leisure industries are often referred to as ...",0.30683,Somewhat-Bullish,321.48,320.48,324.44,319.93,3735944.0,61388.0,321.64179
2022-12-12,This Favorable Sign Appears On Home Depot's Chart - Home Depot  ( NYSE:HD ) ,https://www.benzinga.com/markets/22/12/30042373/this-favorable-sign-appears-on-home-depots-chart,"If history is any guide, there may be good fortune ahead for shares of Home Depot HD. A so-called ""golden cross"" has formed on its chart and, not surprisingly, this could be bullish for the stock. What To Know: Many traders use moving average crossover systems to make their decisions.",0.235845,Somewhat-Bullish,323.0,327.98,328.34,321.29,4894884.0,72039.0,325.980656
2022-12-13,Fake vs. Real Christmas Tree: Which Will Save You More?,https://www.kiplinger.com/personal-finance/shopping/fake-vs-real-christmas-tree-which-will-save-you-more,The fake vs real Christmas tree debate has been simmering on for years. Traditionalists and romantics point to the festive smell and that sense of bringing the natural world into your home. Pragmatists point to the practicality ( and environmental benefits ) of reusing the same tree year after ...,0.099857,Neutral,344.35,332.89,347.25,329.96,5729278.0,100756.0,335.396663
2022-12-14,Here's What Keeps Home Depot  ( HD )  Attractive for Long Term,https://www.zacks.com/stock/news/2028643/heres-what-keeps-home-depot-hd-attractive-for-long-term,"Home Depot (HD) looks poised for growth on the back of its investment strategies, particularly digital and Pro business investments, as well as continued demand for home improvement projects.",0.424545,Bullish,330.53,333.43,339.055,329.0075,4447585.0,80091.0,334.535382
2022-12-15,Home Depot  ( HD )  Up 5.9% Since Last Earnings Report: Can It Continue?,https://www.zacks.com/stock/news/2029248/home-depot-hd-up-59-since-last-earnings-report-can-it-continue,Home Depot (HD) reported earnings 30 days ago. What's next for the stock? We take a look at earnings estimates for some clues.,0.270405,Somewhat-Bullish,329.44,327.6,330.02,323.3705,5035369.0,95563.0,326.840779
2022-12-16,Nike Stock Among 2023 'Highest Conviction' Picks By UBS Ahead Of Quarterly Results,https://www.investors.com/research/earnings-preview/nike-stock-among-2023-highest-conviction-picks-by-ubs-ahead-of-quarterly-results/,Nike Stock Among 2023 'Highest Conviction' Picks By UBS Ahead ... Investor's Business Daily ...,0.067653,Neutral,323.43,323.34,327.94,319.2422,9590309.0,93627.0,323.072596
2022-12-19,Christmas tree demand remains high despite inflation,https://apnews.com/article/inflation-business-306084a718844474d9ca01e10c8b865d,"Larry Gurnee carries a $55 Christmas tree he selected with his wife, , Libby Gurnee, background, at a Rotary Club tree sale, Wednesday, Dec. 14, 2022, in South Portland, Maine.",0.037665,Neutral,319.5,317.33,321.91,316.02,2996687.0,63613.0,318.382906
2022-12-20,Sluggish Holiday Sales Could Bring Huge Last-Minute Discounts,https://www.kiplinger.com/personal-finance/shopping/sluggish-holiday-sales-could-bring-huge-last-minute-discounts,Retailers across the U.S. are seeing significant drops in holiday sales as shoppers who spent early tighten their wallets in fear of a deepening recession despite a recent cooling.,0.295148,Somewhat-Bullish,313.32,314.84,316.887,310.83,2628953.0,59033.0,314.733786
2022-12-21,3 High-Yielding Dividend Stocks You Can Buy and Forget About,https://www.fool.com/investing/2022/12/21/high-yielding-dividend-stocks-you-buy-and-forget/,These are safe long-term investments to hold that will also provide you with reliable dividend income over the years.,0.311802,Somewhat-Bullish,318.05,319.36,319.59,314.74,2604033.0,53028.0,317.990508
2022-12-22,"Another Year, Another Weatherhead 100 Award Win for CLEANLIFE®",https://www.prnewswire.com/news-releases/another-year-another-weatherhead-100-award-win-for-cleanlife-301708566.html,"CLEVELAND, Dec. 22, 2022 /PRNewswire/ -- CLEANLIFE®, a leading provider of highly customized LED lighting solutions and smart home technology, has been named a Weatherhead 100 Award winner presented by the prestigious business school of the same name at Case Western Reserve University.",0.581738,Bullish,316.4,316.12,316.4,310.725,3054565.0,63104.0,314.311888
2022-12-23,Samsung Recalls Washing Machines Due to Fire Hazard,https://www.thestreet.com/investing/samsung-recalls-washing-machines-due-to-fire-hazard,"Samsung has received received reports of smoking, melting, overheating or fire, and reports of injuries, involving the washers.",0.097969,Neutral,314.15,318.73,319.1,313.06,2063033.0,48306.0,317.048672
2022-12-27,"Buy shares of only the strongest companies to make money in 2023, including 'the kings of cash flow,' says this five-star fund manager",https://www.marketwatch.com/story/buy-shares-of-only-the-strongest-companies-to-make-money-in-2023-including-the-kings-of-cash-flow-says-this-five-star-fund-manager-11672149843,Greg Adams of Alger explains his successful strategy for selecting quality stocks.,0.151138,Somewhat-Bullish,318.41,319.55,321.547,317.51,1605480.0,41163.0,319.760497
2022-12-28,The White House embraced debt forgiveness in 2022. Here's what student-loan borrowers can expect in 2023.,https://www.marketwatch.com/story/the-white-house-embraced-debt-forgiveness-in-2022-heres-what-student-loan-borrowers-can-expect-in-2023-11672242526,2023 will likely be the year when borrowers learn how it will impact their wallets.,0.053395,Neutral,320.55,315.73,321.4328,315.5,1553822.0,41196.0,317.455955
2022-12-29,Rising Interest Rates Imperil Remodeling Mania,https://www.wsj.com/articles/rising-interest-rates-imperil-remodeling-mania-11672322258,"Covid lockdown spurred spending on home projects, but rate increases threaten to end the surge.",-0.014804,Neutral,318.65,320.41,321.83,317.59,1551671.0,39748.0,320.552492
2022-12-30,The year that brought Silicon Valley back down to earth | Business,https://www.cnn.com/2022/12/30/tech/silicon-valley-falls-back-to-earth/index.html,The year that brought Silicon Valley back down to earth ...,0.004822,Neutral,317.49,315.86,318.17,313.0218,2553216.0,55860.0,315.307359
2023-01-03,"Lutron Introduces the Diva Smart Dimmer in Additional Colors, and an All-New Accessory Switch, to the Caséta Smart Lighting Control System",https://www.prnewswire.com/news-releases/lutron-introduces-the-diva-smart-dimmer-in-additional-colors-and-an-all-new-accessory-switch-to-the-caseta-smart-lighting-control-system-301711485.html,"Lutron Introduces the Diva Smart Dimmer in Additional Colors, and ... PR ...",0.406325,Bullish,317.42,315.91,319.22,311.78,2788000.0,59068.0,315.345324
2023-01-04,"PYPL's Outgoing Traffic From Prominent Merchants Stabilized, Analyst Says - PayPal Holdings  ( NASDAQ:PYPL ) ",https://www.benzinga.com/analyst-ratings/analyst-color/23/01/30277838/pypls-outgoing-traffic-from-prominent-merchants-stabilized-analyst-says,"Mizuho analyst Dan Dolev reiterated Buy on PayPal Holdings, Inc PYPL with a $105.00 price target. For analysis, Dolev used web traffic data at 15 of PYPL's largest e-commerce checkout partners, including Etsy, Inc ETSY, Nike, Inc NKE, and Home Depot, Inc HD.",0.053206,Neutral,321.07,319.73,322.51,316.3753,3539803.0,57670.0,319.774232
2023-01-05,"What CNBC's 'Final Trades' Says About Home Depot, Lamar Advertising, Newmont And This Leading Automaker",https://www.benzinga.com/trading-ideas/long-ideas/23/01/30289067/what-cnbcs-final-trades-says-about-home-depot-lamar-advertising-newmont-and-this-leading,"On CNBC's ""Halftime Report Final Trades,"" Karen Firestone of Aureus Asset Management said Home Depot Inc HD had a tough year in 2022. News about higher interest rates and softness on building is in the stock, but people can still spend money on home innovation, she added.",0.272127,Somewhat-Bullish,317.83,315.47,318.075,313.23,2905470.0,64566.0,315.336471
2023-01-09,Are Options Traders Betting on a Big Move in Home Depot  ( HD )  Stock?,https://www.zacks.com/stock/news/2036846/are-options-traders-betting-on-a-big-move-in-home-depot-hd-stock,Investors need to pay close attention to Home Depot (HD) stock based on the movements in the options market lately.,0.057396,Neutral,320.0,317.81,322.5499,317.06,3466612.0,60414.0,319.171318
2023-01-10,Are You a Value Investor? This 1 Stock Could Be the Perfect Pick,https://www.zacks.com/stock/news/2037392/are-you-a-value-investor-this-1-stock-could-be-the-perfect-pick,"Wondering how to pick strong, market-beating stocks for your investment portfolio? Look no further than the Zacks Style Scores.",0.462009,Bullish,316.3,320.63,320.73,313.96,2111323.0,50287.0,318.223717
2023-01-11,Home Depot to change pay policy for hourly employees,https://www.reuters.com/business/retail-consumer/home-depot-change-pay-policy-hourly-employees-2023-01-11/,"Jan 11 ( Reuters ) - Home Depot Inc ( HD.N ) said on Wednesday it will change its pay policy for hourly employees starting Jan. 16, with associates being paid based on exact time punches.",-0.058756,Neutral,322.55,329.0,329.04,322.12,2865254.0,62385.0,327.252628
2023-01-12,Walmart partners with Salesforce to offer GoLocal shipping to other retailers,https://www.upi.com/Top_News/US/2023/01/12/walmart-salesforce-GoLocal-retailers/8611673536176/,"Starting in the spring, Walmart said it plans to offer its Store Assist app, which helps workers pack orders for curbside pickup and delivery, and GoLocal home delivery service to other retailers through the Salesforce AppExchange. Advertisement",0.202054,Somewhat-Bullish,332.21,329.87,332.21,326.71,2481803.0,54632.0,329.994652
2023-01-13,Should SPDR Dow Jones Industrial Average ETF  ( DIA )  Be on Your Investing Radar?,https://www.zacks.com/stock/news/2038869/should-spdr-dow-jones-industrial-average-etf-dia-be-on-your-investing-radar,Style Box ETF report for DIA ...,0.228995,Somewhat-Bullish,326.49,331.21,332.3899,326.0,2787593.0,59113.0,330.488714
2023-01-17,Recession Could Tank The S&P Another 22%-But Tesla And These Other Stocks Could Withstand The Downturn,https://www.forbes.com/sites/dereksaul/2023/01/17/recession-could-tank-the-sp-another-22-but-tesla-and-these-other-stocks-could-withstand-the-downturn/,"Tesla, which shed 65% of its share value in 2022, is among Goldman Sachs' top stock picks in a mild recession scenario.",-0.180755,Somewhat-Bearish,330.33,327.53,335.1631,327.1,3981905.0,59924.0,328.933146
2023-01-18,Ana Walshe Case: Husband Pleads Not Guilty To Murder Charges,https://www.forbes.com/sites/conormurray/2023/01/18/ana-walshe-case-husband-pleads-not-guilty-to-murder-charges/,"Police found a bloody knife in the basement of the Walshe family's Cohasset, Massachusetts home.",-0.278058,Somewhat-Bearish,330.0,323.69,334.52,322.93,2952268.0,58087.0,326.709376
2023-01-19,"Trace Labs, the core development company of OriginTrail, joins Sustainable Medicines Partnership to help make medicines more accessible and sustainable",https://www.benzinga.com/pressreleases/23/01/n30487347/trace-labs-the-core-development-company-of-origintrail-joins-sustainable-medicines-partnership-to-,"LJUBLJANA, Slovenia, Jan. 19, 2023 /PRNewswire/ -- Trace Labs, the core development company of OriginTrail, is excited to announce that they have joined the Sustainable Medicines Partnership ( SMP ) , a not-for-profit, multi-stakeholder, action collaborative of 48 organizations.",0.393488,Bullish,320.34,310.88,321.3399,310.63,5360447.0,89723.0,313.323076
2023-01-20,Could Alphabet Cuts Spell a Potentially Tough Year Ahead for Tech?,https://www.benzinga.com/markets/23/01/30504478/could-alphabet-cuts-spell-a-potentially-tough-year-ahead-for-tech,"( Friday Market Open ) The weekend probably can't come soon enough for the info tech world with Friday's latest round of layoffs. This time, it's Alphabet GOOGL announcing 12,000 job cuts. That follows Microsoft MSFT earlier this week and other major mega-cap tech companies slicing their ...",-0.060092,Neutral,310.01,315.0,315.24,307.3901,3725066.0,68467.0,312.065414
2023-01-23,Rising Star: Wayfair's Impressive Revenue Trends Catch Top Analysts' Attention,https://www.benzinga.com/analyst-ratings/analyst-color/23/01/30526155/rising-star-wayfairs-impressive-revenue-trends-catch-top-analysts-attention,"The home furnishings industry is seeing a shining star rise from the pandemic, as Wayfair Inc. W sets its sights on achieving breakeven or better EBITDA for the first time since 2020.",0.3784,Bullish,313.54,315.48,317.53,311.09,3237992.0,65168.0,315.186213
2023-01-24,Better Buy: Home Depot vs. Wayfair,https://www.fool.com/investing/2023/01/24/better-buy-home-depot-vs-wayfair/,Which home-oriented stock is the better buy for 2023?,0.065794,Neutral,314.49,317.69,318.0999,312.63,2127996.0,49199.0,316.685254
2023-01-25,Stock Market Sell-Off: Is Home Depot a Buy?,https://www.fool.com/investing/2023/01/25/stock-market-sell-off-is-home-depot-a-buy/,"Home Depot may face near-term challenges, but its long-term prospects remain strong.",-0.009843,Neutral,315.33,317.26,318.12,311.55,2060533.0,50486.0,315.779297
2023-01-26,Walmart's GoLocal NRF Debut Hints At More AWS-Like Tech Competition,https://www.forbes.com/sites/nikkibaird/2023/01/26/walmarts-golocal-nrf-debut-hints-at-more-aws-like-tech-competition/,"Walmart has responded time and again to Amazon's moves, going all the way back to the dot-com launch. A marketplace. A membership. Grocery delivery. But one thing Walmart had not done was try to commercialize its technology - until now.",0.22043,Somewhat-Bullish,314.15,313.81,319.26,312.53,3556871.0,71033.0,314.517755
2023-01-27,$1000 Invested In Home Depot 15 Years Ago Would Be Worth This Much Today,https://www.benzinga.com/news/earnings/23/01/30602866/1000-invested-in-home-depot-15-years-ago-would-be-worth-this-much-today,"Home Depot HD has outperformed the market over the past 15 years by 9.67% on an annualized basis producing an average annual return of 17.09%. Currently, Home Depot has a market capitalization of $319.83 billion.",0.160819,Somewhat-Bullish,312.02,316.69,318.24,311.33,2761169.0,56948.0,315.683695
2023-01-30,Colorado hardware store robbed in broad daylight: 'Decriminalized theft' is the problem,https://www.foxbusiness.com/retail/colorado-hardware-store-robbed-in-broad-daylight-decriminalized-theft-is-the-problem,"Todd Erwin said retail crime is rocking his Colorado Ace Hardware store daily, and the problem that once consisted of petty thieves and small shoplifting has since escalated into something much worse. ""We're getting hit every single day,"" he told FOX Business' Maria Bartiromo on Monday.",-0.341366,Somewhat-Bearish,315.83,314.24,318.14,313.69,2643142.0,57583.0,315.232771
2023-01-31,Best Stocks To Buy Today? 2 Consumer Discretionary Stocks In Focus,https://stockmarket.com/featured/best-stocks-to-buy-today-2-consumer-discretionary-stocks-in-focus-2023-01-31,"Consumer discretionary refers to a category of consumer goods and services that have the label of non-essential. Also, consumer discretionary items are generally dependent on economic conditions. This sector includes products such as automobiles, recreation and leisure products, retail goods, and ...",0.303454,Somewhat-Bullish,315.99,324.17,324.35,315.095,3526960.0,67060.0,321.946597
2023-02-01,Home Depot  ( HD )  Outpaces Stock Market Gains: What You Should Know,https://www.zacks.com/stock/news/2047967/home-depot-hd-outpaces-stock-market-gains-what-you-should-know,"In the latest trading session, Home Depot (HD) closed at $328.09, marking a +1.21% move from the previous day.",0.206638,Somewhat-Bullish,322.39,328.09,330.545,317.6382,3076534.0,67611.0,323.937038
2023-02-02,Wall Street Bulls Look Optimistic About Home Depot  ( HD ) : Should You Buy?,https://www.zacks.com/stock/news/2048349/wall-street-bulls-look-optimistic-about-home-depot-hd-should-you-buy,"According to the average brokerage recommendation (ABR), one should invest in Home Depot (HD). It is debatable whether this highly sought-after metric is effective because Wall Street analysts' recommendations tend to be overly optimistic. Would it be worth investing in the stock?",0.272484,Somewhat-Bullish,333.45,339.79,341.4691,332.69,4776830.0,93784.0,338.584351
2023-02-03,"The Home Depot, Inc.  ( HD )  Is a Trending Stock: Facts to Know Before Betting on It",https://www.zacks.com/stock/news/2049507/the-home-depot-inc-hd-is-a-trending-stock-facts-to-know-before-betting-on-it,"Zacks.com users have recently been watching Home Depot (HD) quite a bit. Thus, it is worth knowing the facts that could determine the stock's prospects.",0.221648,Somewhat-Bullish,332.53,331.5,334.7099,330.33,3389884.0,70053.0,331.969698
