Article Headline,Article URL,Article Text,overall_sentiment_score,overall_sentiment_label,Stock Open,Stock Close,Stock High,Stock Low,volume,num_trades,adj_close,Ticker
Amazon  ( AMZN )  to Boost Sports Streaming With Standalone App,https://www.zacks.com/stock/news/2033951/amazon-amzn-to-boost-sports-streaming-with-standalone-app,Amazon (AMZN) is building a standalone application to show live sports content. The recent move is a step forward to strengthen its sports-streaming efforts.,0.355691,Bullish,85.73,86.88,87.12,85.225,23134125.0,175408.0,86.261811,DIS
"Quickplay Announces 2022 Results, Including 320% Increase in Recurring Revenue from 2020",https://www.newswire.ca/news-releases/quickplay-announces-2022-results-including-320-increase-in-recurring-revenue-from-2020-878761725.html,"Quickplay Announces 2022 Results, Including 320% Increase in ... Canada ...",0.418483,Bullish,88.98,88.97,89.9716,87.83,14897284.0,139058.0,88.822368,DIS
Alphabet  ( GOOGL )  to Boost YouTube TV With Multi-Screen Viewing,https://www.zacks.com/stock/news/2035264/alphabet-googl-to-boost-youtube-tv-with-multi-screen-viewing,Alphabet's (GOOGL) subsidiary Google is working on a multi-screen viewing capability on YouTube TV.,0.4278,Bullish,90.0,91.98,92.745,89.36,14888919.0,140195.0,91.716985,DIS
Mobile Gaming Global Market Report 2022,https://www.benzinga.com/pressreleases/23/01/n30296163/mobile-gaming-global-market-report-2022,"DUBLIN, Jan. 5, 2023 /PRNewswire/ -- The ""Mobile Gaming Global Market Report 2022"" report has been added to ResearchAndMarkets.com's offering. This report provides the strategists, marketers and senior management with the critical information they need to assess the global mobile gaming market.",0.171292,Somewhat-Bullish,91.66,91.92,92.48,90.51,11531717.0,109109.0,91.654323,DIS
Stock Market Sell-Off: Is Disney a Buy in 2023?,https://www.fool.com/investing/2023/01/06/stock-market-sell-off-is-disney-a-buy/,"Disney made multiple restructuring moves in 2022, and it could begin reaping the rewards in 2023.",0.298309,Somewhat-Bullish,92.66,93.92,94.69,91.3211,9778864.0,113270.0,93.624623,DIS
Ideal Image Announces Sharon M. Leite as CEO,https://www.benzinga.com/pressreleases/23/01/g30336383/ideal-image-announces-sharon-m-leite-as-ceo,"TAMPA, Fla., Jan. 09, 2023 ( GLOBE NEWSWIRE ) -- Ideal Image, the #1 Aesthetics Brand in North America, announced that Sharon M. Leite has been named as its new Chief Executive Officer, effective today. Ms. Leite will succeed David Prokupek, the Company's current CEO who will continue with the ...",0.557547,Bullish,94.43,94.77,95.7,93.45,11677763.0,126838.0,94.894001,DIS
Disneyland Paris is Bringing a Marvelous New Nighttime Show to Guests,https://www.thestreet.com/travel/disneyland-paris-is-bringing-a-marvelous-new-nighttime-show-to-guests,The park is celebrating its 30th anniversary with one of its biggest properties.,0.41154,Bullish,94.28,95.56,95.64,93.82,6916626.0,88281.0,94.940806,DIS
"Disney Announces Opening Day For TRON, Rolls Back Restrictions And Added Fees For Park Goers",https://www.forbes.com/sites/megandubois/2023/01/11/disney-announces-opening-day-for-tron-rolls-back-restrictions-and-added-fees-for-park-goers/,"April 4, 2023, is set to be a big day at Walt DisneyDIS World's Magic Kingdom in Orlando, Florida. The highly anticipated attraction TRON Lightcycle / Run will finally open to guests after being originally announced in 2017.",0.277548,Somewhat-Bullish,95.92,96.33,96.55,95.045,8792885.0,107175.0,96.194214,DIS
"Disney  ( DIS )  Wins Big in Golden Globe 2023, Beats Netflix",https://www.zacks.com/stock/news/2038600/disney-dis-wins-big-in-golden-globe-2023-beats-netflix,"The Walt Disney (DIS) wins nine awards at this year's Golden Globe, including the category of Best Picture, Musical or Comedy with The Banshees of Inisherin.",0.494722,Bullish,98.5,99.81,100.63,97.5705,19814324.0,199309.0,99.527202,DIS
"Company News for Jan 13, 2023",https://www.zacks.com/stock/news/2039024/company-news-for-jan-13-2023,"Companies In The News Are: KBH, AAL, DIS, LOGI.",0.060753,Neutral,99.38,99.4,99.6,98.01,12211055.0,129082.0,99.024884,DIS
Disney pushes back on Nelson Peltz,https://www.foxbusiness.com/markets/disney-pushes-back-nelson-peltz,"Less than a week after activist investor Nelson Peltz filed a preliminary proxy statement for a seat on Disney's board of directors and said the media giant was ""in crisis,"" the entertainment giant is pushing back.",-0.036123,Neutral,100.32,99.91,100.99,98.995,14894484.0,146433.0,100.029688,DIS
DISNEY100: THE EXHIBITION - DISNEY REVEALS 23 ARTIFACTS TO BE SHOWCASED AT THE FRANKLIN INSTITUTE AS THE COUNTDOWN TO THE WORLD PREMIERE BEGINS,https://www.benzinga.com/pressreleases/23/01/n30463540/disney100-the-exhibition-disney-reveals-23-artifacts-to-be-showcased-at-the-franklin-institute-as-,"The exhibition, celebrating 100 years of The Walt Disney Company, opens February 18, 2023, at Philadelphia's Franklin Institute THESE ""CROWN JEWELS"" FROM FAVORITE DISNEY STORIES WILL BE ON DISPLAY FOR FANSTO ENJOY AND INCLUDE THE HOCUS POCUS SPELL BOOK, BB-8 PUPPET,BLACK PANTHER COSTUME AND MORE",0.298649,Somewhat-Bullish,100.28,99.04,101.1299,98.7249,11391715.0,123710.0,99.566653,DIS
Alphabet  ( GOOGL )  to Boost YouTube TV With Redesigned Features,https://www.zacks.com/stock/news/2041189/alphabet-googl-to-boost-youtube-tv-with-redesigned-features,Alphabet's (GOOGL) subsidiary Google redesigns Library and Live tabs to provide a user-friendly interface based on personalized suggestions.,0.393611,Bullish,98.12,99.08,99.45,97.12,10976298.0,114613.0,98.649213,DIS
3 Consumer Discretionary Stocks To Watch In The Stock Market Today,https://stockmarket.com/featured/3-consumer-discretionary-stocks-to-watch-in-the-stock-market-today-2023-01-20,"To begin, consumer discretionary stocks refer to companies that produce or sell goods and services that consumers can choose to purchase or not, such as automobiles, leisure goods, and luxury items.",0.165608,Somewhat-Bullish,100.34,103.48,103.5865,99.3015,14549879.0,145673.0,101.809567,DIS
"The Worldwide Online Entertainment Industry is Expected to Reach $1,049 Billion by 2027",https://www.benzinga.com/pressreleases/23/01/n30519048/the-worldwide-online-entertainment-industry-is-expected-to-reach-1-049-billion-by-2027,"DUBLIN, Jan. 23, 2023 /PRNewswire/ -- The ""Online Entertainment Market: Global Industry Trends, Share, Size, Growth, Opportunity and Forecast 2022-2027"" report has been added to ResearchAndMarkets.com's offering. The global online entertainment market size reached US$ 294.16 Billion in 2021.",0.278572,Somewhat-Bullish,103.29,105.69,105.9541,102.9209,11487637.0,143133.0,105.007196,DIS
Nate Silver's FiveThirtyEight could be up for sale,https://www.axios.com/pro/media-deals/2023/01/24/538-sale-talks-abc-news,ABC News consider offloading FiveThirtyEight: The Daily Beast ...,-0.149752,Neutral,105.39,106.0,108.44,102.0,8610602.0,109876.0,106.022448,DIS
Disney's Splash Mountain ride water sells on eBay for thousands following closure of beloved ride,https://www.foxbusiness.com/lifestyle/disney-splash-mountain-ride-water-sells-ebay-thousands-following-closure-beloved-ride,"Hard core Walt Disney World fans who are mourning the closure of the iconic Splash Mountain ride now can remember the attraction- but for a hefty price. Used water from Walt Disney World's now-closed Splash Mountain ride is being sold on eBay, with some listings asking for thousands of dollars ...",0.139991,Neutral,104.96,108.12,108.16,104.18,10010666.0,128494.0,106.534082,DIS
"United States OTT Media Services Markets, Competition, Forecasts and Opportunities, 2028",https://www.benzinga.com/pressreleases/23/01/n30589117/united-states-ott-media-services-markets-competition-forecasts-and-opportunities-2028,"DUBLIN, Jan. 26, 2023 /PRNewswire/ -- The ""United States OTT Media Services Market, By Revenue Model ( SVOD, AVOD ) , By Device Type ( ( Mobile Devices & Computers, Smart TVs & Set-Top Box, Gaming Consoles & Fire Tv Devices ) ) , By Region, Competition Forecast and Opportunities, 2028"" report ...",0.319265,Somewhat-Bullish,108.17,109.7,109.76,107.5701,9207327.0,115883.0,108.69365,DIS
"Disneyland Resort Celebrates Disney100 with Grand Opening of Mickey & Minnie's Runaway Railway, New Nighttime Spectaculars, 'Magic Happens' Parade and More",https://www.benzinga.com/pressreleases/23/01/n30606785/disneyland-resort-celebrates-disney100-with-grand-opening-of-mickey-minnies-runaway-railway-new-ni,"Dazzling celebration honors 100th anniversary of The Walt Disney Company with dcor, food and beverages, merchandise and more New entertainment and attractions debut Jan. 27: Mickey & Minnie's Runaway Railway, 'World of Color - ONE' and 'Wondrous Journeys' nighttime spectaculars and platinum dcor",0.423194,Bullish,109.26,109.54,110.5823,109.16,10249678.0,126350.0,109.89648,DIS
Textiles major Welspun India Q3 net profit declines 66.55% to Rs 43.83 cr,https://www.business-standard.com/article/companies/textiles-major-welspun-india-q3-net-profit-declines-66-55-to-rs-43-83-cr-123013001309_1.html,"Home textiles major Welspun India on Monday reported a 66.55 per cent decline in consolidated net profit at Rs 43.83 crore in the third quarter ended December 2022, impacted by lower sales. The company had posted a consolidated net profit of Rs 131.06 crore in the same quarter last fiscal, ...",0.075733,Neutral,108.26,107.59,108.97,107.48,8549924.0,109904.0,108.127091,DIS
UNDER ARMOUR APPOINTS CAROLYN EVERSON AND PATRICK WHITESELL TO ITS BOARD OF DIRECTORS,https://www.prnewswire.com/news-releases/under-armour-appoints-carolyn-everson-and-patrick-whitesell-to-its-board-of-directors-301734185.html,UNDER ARMOUR APPOINTS CAROLYN EVERSON AND ... PR ...,0.287113,Somewhat-Bullish,107.58,108.49,108.715,107.45,8252499.0,91085.0,108.259744,DIS
3 Growth Stocks to Set You Up for the Next 5 Years,https://www.fool.com/investing/2023/02/01/3-growth-stocks-to-set-you-up-for-the-next-10-year/,Blue-chip growth stocks at a discount? What's not to like?,0.17538,Somewhat-Bullish,108.5,109.39,109.94,106.9,9980042.0,131239.0,108.613929,DIS
"Disney, Nelson Peltz fight escalates in board battle",https://www.foxbusiness.com/markets/disney-nelson-peltz-fight-escalates-board-battle,"Activist investor Nelson Peltz is urging Walt Disney shareholders to drop board director Michael Froman, stating the media and entertainment company's current leadership has failed to instill a culture of accountability and is responsible for the 44% drop in its stock price last year.",-0.036279,Neutral,110.67,113.21,113.53,109.6901,13104666.0,170458.0,112.051463,DIS
Activist Investor Nelson Peltz Steps Up Pressure on Disney Board,https://www.wsj.com/articles/activist-investor-nelson-peltz-steps-up-pressure-on-disney-board-11675387137,"Mr. Peltz's open letter calls for the removal of a director and criticizes the pay given to executives like CEO Bob Iger, who has realized $1.1 billion in total compensation since 2007.",-0.202459,Somewhat-Bearish,111.47,110.71,113.1412,110.37,12472478.0,149920.0,111.650716,DIS
Ford Is Returning To Formula 1: Here Are The Details And Why It Could Help The Company,https://www.benzinga.com/news/23/02/30732323/ford-is-returning-to-formula-1-here-are-the-details-and-why-it-could-help-the-company,"After more than 20 years out of the sport, Ford Motor Company F is returning to Formula 1 racing. Here's a look at why the time is now for Ford and how it could help the automaker's push into electric vehicles. What Happened: Ford announced it is partnering with the Red Bull Racing team to rejoin ...",0.248756,Somewhat-Bullish,110.17,109.87,110.43,108.53,11959271.0,143695.0,109.467408,DIS
Disney  ( DIS )  to Post Q1 Earnings: Key Factors to Consider,https://www.zacks.com/stock/news/2051075/disney-dis-to-post-q1-earnings-key-factors-to-consider,"Disney's (DIS) first-quarter fiscal 2023 results are likely to reflect stalled Disney+ subscriber growth, as well as the strong contribution from the Avatar sequel.",0.335378,Somewhat-Bullish,109.295,111.63,112.12,108.86,10856508.0,137266.0,110.579003,DIS
Commercial Metals and Ovintiv have been highlighted as Zacks Bull and Bear of the Day,https://www.zacks.com/stock/news/2051454/commercial-metals-and-ovintiv-have-been-highlighted-as-zacks-bull-and-bear-of-the-day,"Chicago, IL - February 8, 2023 - Zacks Equity Research shares Commercial Metals Company ( CMC Quick QuoteCMC - ) as the Bull of the Day and Ovintiv ( OVV Quick QuoteOVV - ) as the Bear of the Day.",0.223814,Somewhat-Bullish,112.2,111.78,113.33,110.29,27937284.0,301401.0,114.025319,DIS
Peltz' Trian ends Disney board challenge after CEO Iger lays out changes,https://www.reuters.com/business/media-telecom/peltz-trian-ends-disney-board-challenge-after-ceo-iger-lays-out-key-changes-2023-02-09/,Peltz' Trian ends Disney board challenge after CEO Iger lays out key ... ...,0.098594,Neutral,118.04,110.36,118.18,109.8089,46168573.0,418127.0,114.120581,DIS
Can Disney Afford To Pay a Dividend?,https://www.fool.com/investing/2023/02/10/can-disney-afford-to-pay-a-dividend/,Disney is finally preparing to bring back the dividend.,0.062462,Neutral,108.96,108.06,109.74,107.21,15565987.0,171314.0,108.194834,DIS
2023 UCA NATIONAL HIGH SCHOOL CHEERLEADING CHAMPIONSHIP HONORS TOP TEAMS,https://www.benzinga.com/pressreleases/23/02/n30879201/2023-uca-national-high-school-cheerleading-championship-honors-top-teams,"MEMPHIS, Tenn., Feb. 13, 2023 /PRNewswire/ -- Varsity Spirit - the global leader in cheerleading, dance team and band apparel, camps and competitions, and a division of Varsity Brands, the market leader in team sports, school spirit and achievement recognition - is pleased to announce that the ...",0.444833,Bullish,108.1,107.66,108.2874,106.55,12344702.0,146431.0,107.57735,DIS
DIS: Is Disney Stock a Buy or Sell in 2023?,https://stocknews.com/news/dis-amcx-is-disney-stock-a-buy-or-sell-in-2023/,"Media and entertainment giant The Walt Disney Company ( DIS ) is going through a major transition under the leadership of its returned CEO, Robert A. Iger, after the company's board decided to let go of Bob Chapek, Mr. Iger's handpicked successor.",0.135376,Neutral,106.82,107.66,108.44,105.8205,10769940.0,116782.0,107.49628,DIS
"Disney+ Could Be Changing Its Marvel Plan: Here's What Viewers, DIS Shareholders Should Know - Walt Disney  ( NYSE:DIS ) ",https://www.benzinga.com/general/entertainment/23/02/30929505/disney-could-be-changing-its-marvel-plan-heres-what-viewers-should-know,"One of the keys to the success of The Walt Disney Company DIS over the years may be its acquisition of Marvel Entertainment, which was announced in 2009. With a focus on streaming content, theatrical releases and the return of former CEO Bob Iger, the forward strategy of Marvel could be a big ...",0.271404,Somewhat-Bullish,107.09,109.24,109.27,106.7,8167034.0,109740.0,108.20322,DIS
The Contradictions of Ron DeSantis,https://www.theatlantic.com/ideas/archive/2023/02/ron-desantis-2024-polls-woke-ideology-culture-war/673080/,"He has ignited so many cultural confrontations that they're difficult to keep track of, but he has acted most aggressively on education. Governor Ron DeSantis of Florida hasn't officially decided whether he'll seek the 2024 GOP presidential nomination.",0.036353,Neutral,107.55,105.83,108.02,105.7,9490021.0,113956.0,106.894597,DIS
CMCSA: 1 Entertainment Stock to Watch Right Now and 2 to Avoid,https://stocknews.com/news/cmcsa-dis-dlpn-1-entertainment-stock-to-watch-right-now-and-2-to/,"Amid looming recession fears, job cuts in the entertainment industry are widespread. Steve Ross, a USC history professor who has written books about labor and class in Hollywood, said, ""It sure is one of the largest sets of cuts. And I think we're going to see more cuts.""",0.162185,Somewhat-Bullish,103.55,102.09,103.73,101.83,10650913.0,131909.0,102.390255,DIS
Pence says he disagrees with DeSantis's going after Disney's tax status because he's a 'limited-government Republican',https://www.marketwatch.com/story/pence-says-as-a-limited-government-republican-he-disagrees-with-desantis-going-after-disneys-tax-status-7c562e51,"Pence says he supports Florida's 'Don't Say Gay' law, but he's critical of DeSantis's interference in the matter.",0.033587,Neutral,101.33,101.68,102.56,101.09,9885963.0,105684.0,101.840903,DIS
"Disney, Nasdaq And 2 Other Stocks Insiders Are Selling - Nasdaq  ( NASDAQ:NDAQ ) , Walt Disney  ( NYSE:DIS ) ",https://www.benzinga.com/news/23/02/31026947/disney-nasdaq-and-2-other-stocks-insiders-are-selling,"The S&P 500 recorded losses for the fourth session in a row on Wednesday. Investors, meanwhile, focused on some notable insider trades. When insiders sell shares, it indicates their concern in the company's prospects or that they view the stock as being overpriced.",0.181702,Somewhat-Bullish,101.45,101.73,102.0499,99.605,10976735.0,123653.0,101.023392,DIS
"Jurassic World: The Exhibition Roars into Toronto on April 14, 2023 for a Limited Engagement",https://www.newswire.ca/news-releases/jurassic-world-the-exhibition-roars-into-toronto-on-april-14-2023-for-a-limited-engagement-844979153.html,"Jurassic World: The Exhibition Roars into Toronto on April 14, 2023 ... Canada ...",0.378003,Bullish,100.73,100.45,101.47,100.06,6642437.0,87940.0,100.699724,DIS
DeSantis agreed to get married at Disney World as long as Donald Duck and Mickey Mouse weren't invited,https://www.businessinsider.com/desantis-married-disney-world-no-mickey-mouse-donald-ducks-2023-2,DeSantis Had One Condition for Being Married at Disney World - Business Insider ...,0.198119,Somewhat-Bullish,100.45,99.61,100.75,99.57,8237066.0,89416.0,99.876527,DIS
Disney's PhotoPass Service Combines New Tech With Disney Storytelling,https://www.forbes.com/sites/megandubois/2023/03/01/disneys-photopass-service-combines-new-tech-with-disney-storytelling/,"While many people who venture into the Disney Parks think of the service as a way to simply get their photo taken in front of the major park icons, there's a lot more to Disney PhotoPass than a click of the shutter button.",0.179397,Somewhat-Bullish,99.19,98.54,99.63,98.1,7905108.0,100223.0,98.703828,DIS
"Digital Video Content Market to grow at a CAGR of 14.84% from 2022 to 2027, Analysis of Amazon Co., AT&T Co., and Chicken Soup Co., among other top players - Technavio",https://www.benzinga.com/pressreleases/23/03/n31174883/digital-video-content-market-to-grow-at-a-cagr-of-14-84-from-2022-to-2027-analysis-of-amazon-co-at,"NEW YORK, March 2, 2023 /PRNewswire/ -- The digital video content market size is expected to grow by USD 464.62 billion during 2022-2027. The market is expected to progress at a CAGR of 14.84% during the forecast period, according to Technavio. are some of the major market participants - Request ...",0.178437,Somewhat-Bullish,97.74,98.92,99.29,97.42,7783809.0,89993.0,98.384386,DIS
"Digital Content Market Size to Grow by USD 694.88 Billion at a CAGR of 13.78% between 2022 and 2027, Historic market size valued at USD 439.52 Billion from 2017 to 2021 - Technavio",https://www.benzinga.com/pressreleases/23/03/n31203676/digital-content-market-size-to-grow-by-usd-694-88-billion-at-a-cagr-of-13-78-between-2022-and-2027,"NEW YORK, March 3, 2023 /PRNewswire/ -- The digital content market is projected to increase at a CAGR of 13.78% during the forecast period - 2022 to 2027 by Technavio data analysts and research experts. This market research report also suggests statistics about the market size that will grow by ...",0.252371,Somewhat-Bullish,99.67,101.14,101.18,98.88,7434264.0,97677.0,100.479513,DIS
My Take: 4 Strong Growth Stocks to Buy This Week,https://www.fool.com/investing/2023/03/07/my-take-4-strong-growth-stocks-to-buy-this-week/,These companies' stocks make excellent investments to buy now and hold indefinitely.,0.271498,Somewhat-Bullish,100.4,99.06,100.94,98.89,6952992.0,95487.0,99.530415,DIS
"New Podcast ""The Disney Way for the Digital Age"" Explores the Intersection of AI Technology and Customer Experience",https://www.benzinga.com/pressreleases/23/03/n31280801/new-podcast-the-disney-way-for-the-digital-age-explores-the-intersection-of-ai-technology-and-cust,"NEW YORK, March 9, 2023 /PRNewswire-PRWeb/ -- FOR IMMEDIATE RELEASE New Podcast ""The Disney Way for the Digital Age"" Explores the Intersection of AI Technology and Customer Experience",0.389369,Bullish,99.45,96.14,100.05,95.92,8277929.0,114673.0,97.491584,DIS
"For The First Time, Disney Parks Takes The Stage at SXSW 2023",https://www.prnewswire.com/news-releases/for-the-first-time-disney-parks-takes-the-stage-at-sxsw-2023-301769300.html,"Chairman Josh D'Amaro Shares Art & Science Behind Disney's Timeless Storytelling, Glimpse into Innovations in Development Presentation Reveals How Creativity and Innovation Spark Connection and Happiness",0.433145,Bullish,95.6,93.57,95.9,92.83,13978845.0,188511.0,93.934209,DIS
"What The 5 Best Streaming Services Are In 2023 - Amazon.com  ( NASDAQ:AMZN ) , Walt Disney  ( NYSE:DIS ) ",https://www.benzinga.com/general/entertainment/23/03/31321895/what-the-5-of-the-best-streaming-services-are-in-2023,"As streaming technology continues to rapidly evolve, more and more people are turning to streaming services as their go-to source for entertainment. In 2023, there continues to be a wide variety of streaming services to choose from.",0.14743,Neutral,91.885,92.6,94.0242,90.46,11917348.0,161646.0,92.551182,DIS
SunPower Appoints Steve Louden to its Board of Directors,https://www.prnewswire.com/news-releases/sunpower-appoints-steve-louden-to-its-board-of-directors-301771177.html,"Roku CFO brings extensive business strategy and development experience at high growth companies across technology, retail, and financial services",0.32471,Somewhat-Bullish,94.0,93.36,94.3,92.34,10324876.0,113781.0,93.382281,DIS
"Disney Seeks Help From Google, Reddit Over Ant-Man' Script Leak - Alphabet  ( NASDAQ:GOOG ) , Alphabet  ( NASDAQ:GOOGL ) , Walt Disney  ( NYSE:DIS ) ",https://www.benzinga.com/general/entertainment/23/03/31354386/disney-seeks-to-subpoena-reddit-google-to-find-out-who-leaked-script-of-ant-man,"The Walt Disney Company DIS is seeking help from Reddit and Alphabet Inc. GOOG GOOGL to identify the individual who leaked the script of ""Ant-Man and The Wasp: Quantumania."" What Happened: Owned by Disney, Marvel is known for being notoriously secretive about its projects.",0.072674,Neutral,91.63,93.1,93.3557,91.41,9547462.0,128543.0,92.498959,DIS
MeWe Hires Key Leadership Roles for Marketing and Product Team As Platform Continues to Grow,https://www.benzinga.com/pressreleases/23/03/n31383105/mewe-hires-key-leadership-roles-for-marketing-and-product-team-as-platform-continues-to-grow,"LOS ANGELES, March 16, 2023 /PRNewswire/ -- MeWe, a global, privacy-first social media company that is adopting decentralized technology this year, announced the addition of Michael Huntsman as Senior Vice President of Marketing and Mark Liu as Head of Product.",0.373694,Bullish,92.67,94.29,94.5599,91.89,9946678.0,124635.0,93.696103,DIS
What Stocks To Buy Today? 3 Entertainment Stocks In Focus,https://stockmarket.com/featured/what-stocks-to-buy-today-3-entertainment-stocks-in-focus-2023-03-17,"The entertainment industry is a diverse and rapidly-evolving sector. It encompasses several businesses such as film, television, music, sports, gaming, and live events. The industry has witnessed significant growth in recent years, thanks to technological advancements and the increasing demand ...",0.415,Bullish,94.05,93.2,94.27,92.91,12863611.0,117248.0,93.414095,DIS
Here's the method Chick-fil-A workers use to keep their cool with angry customers,https://www.businessinsider.com/chick-fil-a-handles-angry-customers-heard-model-core-4-2023-3,How Chick-Fil-a Handles Angry Customers Using HEARD Model ... - Business Insider ...,0.190582,Somewhat-Bullish,95.17,96.54,96.85,95.17,7289022.0,96037.0,96.224391,DIS
"Disney, Coinbase Global And 2 Other Stocks Insiders Are Selling - Coinbase Glb  ( NASDAQ:COIN ) , Walt Disney  ( NYSE:DIS ) ",https://www.benzinga.com/news/23/03/31473158/disney-coinbase-global-and-2-other-stocks-insiders-are-selling,"The Nasdaq Composite dropped 1.6% on Wednesday after the Fed raised rates by 25bps. Investors, meanwhile, focused on some notable insider trades. When insiders sell shares, it indicates their concern in the company's prospects or that they view the stock as being overpriced.",0.245774,Somewhat-Bullish,95.28,95.83,97.02,94.76,9527009.0,115136.0,96.069389,DIS
Companies In The Amusement Parks Market Are Adopting Sustainable Practices To Reduce Their Carbon Footprint - By The Business Research Company,https://www.prnewswire.com/news-releases/companies-in-the-amusement-parks-market-are-adopting-sustainable-practices-to-reduce-their-carbon-footprint--by-the-business-research-company-301780724.html,Companies In The Amusement Parks Market Are Adopting ... PR ...,0.415167,Bullish,94.81,94.08,95.0,93.02,9457954.0,126847.0,93.86263,DIS
"Disney layoffs will begin this week, CEO Bob Iger says in memo",https://www.cnbc.com/2023/03/27/disney-layoffs-bob-iger-memo.html,Disney CEO Bob Iger notified employees in a memo that job losses will begin this week.,0.263465,Somewhat-Bullish,94.78,95.62,96.02,94.38,7487900.0,104713.0,95.258384,DIS
"Company News for Mar 28, 2023",https://www.zacks.com/stock/news/2071292/company-news-for-mar-28-2023,Companies in The News ...,-0.064953,Neutral,95.51,94.82,96.0,94.59,5405455.0,78472.0,95.12085,DIS
