Article Headline,Article URL,Article Text,overall_sentiment_score,overall_sentiment_label,Stock Open,Stock Close,Stock High,Stock Low,volume,num_trades,adj_close,Ticker
LOGISTEC Appoints J. Mark Rodger as Chairman and New Member Jane Skoblo to its Board of Directors,https://www.newswire.ca/news-releases/logistec-appoints-j-mark-rodger-as-chairman-and-new-member-jane-skoblo-to-its-board-of-directors-888942040.html,"MONTRAL, May 5, 2022 /CNW Telbec/ - LOGISTEC Corporation  ( ""LOGISTEC"" )  announced today the appointment of J. Mark Rodger as Chairman of its Board of Directors. J. Mark Rodger, a key member of the Board since 2015, succeeds Curtis J. Foltz. LOGISTEC also welcomes new board member Jane Skoblo.",0.302985,Somewhat-Bullish,176.64,171.01,176.76,169.33,2949222.0,55763.0,171.951781,AXP
Womxn's Podcast Network Ossa Collective Launches Crowdfunding Offering on StartEngine.com,https://www.prnewswire.com/news-releases/womxns-podcast-network-ossa-collective-launches-crowdfunding-offering-on-startenginecom-301541501.html,Crowdfunding Campaign Makes Ossa One of the First Podcast Networks to be Owned by Podcasters and Listeners,0.031742,Neutral,169.17,167.15,169.99,165.01,3092314.0,55377.0,167.215431,AXP
Virtu Financial  ( VIRT )  Stock Down 19% Despite Q1 Earnings Beat,https://www.zacks.com/stock/news/1921168/virtu-financial-virt-stock-down-19-despite-q1-earnings-beat,"Virtu Financial's (VIRT) first-quarter results benefit from a decline in expenses, partly offset by weak segmental performances and lower trading volumes.",-0.105071,Neutral,165.03,161.02,166.02,160.38,4443299.0,57809.0,162.201896,AXP
Oil stocks are the new FAANGs,https://www.cnn.com/2022/05/10/investing/oil-energy-stocks/index.html,"New York  (  CNN Business  )  Many investors, including Warren Buffett, are betting that higher crude oil prices are here to stay for a while. It's a good wager, thanks to the spike in oil prices from about $75 a barrel at the end of last year to above $100 now. Nearly all of the top performers in the S&P 500 this year are energy stocks.",-0.019228,Neutral,163.42,161.83,164.73,158.39,2984823.0,60743.0,161.642699,AXP
3 Dow Stocks to Buy More of in May,https://www.fool.com/investing/2022/05/11/3-dow-stocks-to-buy-more-of-in-may/,One is a great opportunity to buy on the dip. Two are solid keepers demonstrating their worth as the market nears bear status.,0.188188,Somewhat-Bullish,161.73,159.39,164.94,159.04,2606183.0,44595.0,160.756106,AXP
"LIM College Business of Cannabis Degree Programs Announce ""All-Star"" Faculty for Fall 2022 Start",https://www.prnewswire.com/news-releases/lim-college-business-of-cannabis-degree-programs-announce-all-star-faculty-for-fall-2022-start-301545350.html,"""When we designed our cannabis degree programs, we wanted to provide our students access to the highest achievers from various parts of the cannabis business.",0.036835,Neutral,155.6,153.27,157.155,149.88,5272992.0,84499.0,153.47146,AXP
What Are Whales Doing With American Express,https://www.benzinga.com/markets/options/22/05/27199167/what-are-whales-doing-with-american-express,"A whale with a lot of money to spend has taken a noticeably bearish stance on American Express. Looking at options history for American Express ( NYSE:AXP ) we detected 30 strange trades. If we consider the specifics of each trade, it is accurate to state that 46% of the investors opened trades wi",-0.037336,Neutral,155.96,158.75,160.09,155.88,3595476.0,54014.0,158.629611,AXP
LIM College Business Of Cannabis Degree Programs Present Their 'All-Star' Faculty For Fall 2022,https://www.benzinga.com/markets/cannabis/22/05/27229695/lim-college-business-of-cannabis-degree-programs-present-their-all-star-faculty-for-fall-2022,"In advance of the September start of its bachelor's and master's degree programs in The Business of Cannabis, LIM College has added some of the cannabis industry's best-known leaders to its faculty. Among these new instructors are four of the cannabis industry's top professionals: Dasheeda Dawson, J",0.024639,Neutral,157.41,156.43,158.74,154.32,2779456.0,50687.0,156.276719,AXP
Warren Buffett's Berkshire Hathaway finally bails on Wells Fargo,https://edition.cnn.com/2022/05/17/investing/berkshire-hathaway-warren-buffett-wells-fargo-citigroup/index.html,"New York ( CNN Business ) Warren Buffett's Berkshire Hathaway has been a top investor in Wells Fargo for the past few years, despite the company's fake account scandal, overcharging foreign-exchange customers and myriad other problems. Now, the Oracle of Omaha has finally thrown in the towel.",-0.0178,Neutral,161.07,161.85,162.7634,158.4,2887102.0,51167.0,161.316725,AXP
4 Top Fintech Stocks To Watch Today,https://stockmarket.com/featured/4-top-fintech-stocks-to-watch-today-2022-05-18,"Are These The Top Fintech Stocks To Buy Now? With the rise of financial technology, there is now a broad selection of fintech stocks in the stock market today. The opportunities within the industry are massive. It now ranges from payment services, banking, investing, insurance, and even ...",0.070982,Neutral,160.79,156.1,160.85,155.4,2650350.0,47964.0,157.042264,AXP
"New Women of Color in Business: Cross-Generational Survey, by Harvard Business School Alumnae and Business Leaders Bonita C. Stewart and Jacqueline Adams, Sponsored by Google, Published Today",https://www.prnewswire.com/news-releases/new-women-of-color-in-business-cross-generational-survey-by-harvard-business-school-alumnae-and-business-leaders-bonita-c-stewart-and-jacqueline-adams-sponsored-by-google-published-today-301551647.html,"In addition to including Black and White male managers, this year's survey takes a deeper look at Asian American women desk workers, with differentiating responses by the women's countries of origin: China, Vietnam, India and the Philippines.",0.200545,Somewhat-Bullish,153.57,154.0,156.46,153.25,2743057.0,53210.0,154.360947,AXP
Delta launches its first A321neo planes with new first-class seats - here's how you can fly in one for almost nothing,https://www.cnn.com/cnn-underscored/travel/delta-airbus-a321neo-first-class-seats,"CNN Underscored reviews financial products such as credit cards and bank accounts based on their overall value. We may receive a commission through the LendingTree affiliate network if you apply and are approved for a card, but our reporting is always independent and objective.",0.182239,Somewhat-Bullish,154.35,153.24,154.8,149.71,2945643.0,56663.0,152.602378,AXP
Q1 2022 Outlook on the Mexico Loyalty Programs Market - Regional Loyalty Program Providers are Seeking to Expand Their Footprint,https://www.prnewswire.com/news-releases/q1-2022-outlook-on-the-mexico-loyalty-programs-market---regional-loyalty-program-providers-are-seeking-to-expand-their-footprint-301553010.html,"DUBLIN, May 23, 2022 /PRNewswire/ -- The ""Mexico Loyalty Programs Market Intelligence and Future Growth Dynamics Databook - 50+ KPIs on Loyalty Programs Trends by End-Use Sectors, Operational KPIs, Retail Product Dynamics, and Consumer Demographics - Q1 2022 Update"" report has been added to ...",0.086632,Neutral,156.61,159.04,159.56,156.02,2708082.0,46940.0,158.551498,AXP
Firework Closes $150M SoftBank Vision Fund 2-Led Series B to Continue to Build the Future of Commerce,https://www.newswire.ca/news-releases/firework-closes-150m-softbank-vision-fund-2-led-series-b-to-continue-to-build-the-future-of-commerce-800083265.html,"The announcement comes as public sentiment towards Big Tech's ""walled-gardens"" - the large, closed ecosystems typified by the likes of Facebook and Amazon - grows increasingly strained.",0.096218,Neutral,157.29,155.63,157.97,152.9232,2794520.0,49152.0,154.894944,AXP
How Many Stocks Should You Have in Your Portfolio?,https://www.kiplinger.com/investing/stocks/604724/how-many-stocks-should-you-have-in-your-portfolio,"With this year's rough ride, you don't need reminding that stocks are volatile. Their prices bounce up and down, sometimes in extreme ways. The U.S. market as a whole has produced average annual returns of about 10% over the past century, but it doesn't go up 10% every year. In roughly one out of fo",-0.095855,Neutral,157.14,160.51,161.76,156.075,4355914.0,46581.0,159.575126,AXP
Using a Credit Card Travel Portal,https://www.kiplinger.com/personal-finance/credit-cards/604723/using-a-credit-card-travel-portal,"Earning points and miles using a travel rewards card is as simple as a swipe. But your credit card company wants to play travel agent, too. American Express, Bank of America, Capital One and Chase, for example, all have travel portals where cardholders can book fights, hotels, rental cars and more u",0.080123,Neutral,162.7,165.37,166.77,162.7,2454747.0,44527.0,165.450261,AXP
Here's How Much You Would Have Made Owning American Express Stock In The Last 5 Years,https://www.benzinga.com/news/earnings/22/05/27446719/heres-how-much-you-would-have-made-owning-american-express-stock-in-the-last-5-years,"American Express ( NYSE:AXP ) has outperformed the market over the past 5 years by 5.55% on an annualized basis producing an average annual return of 16.84%. Currently, American Express has a market capitalization of $126.37 billion. Buying $1000 In AXP: If ...Full story available on Benzinga.com",-0.000725,Neutral,167.08,169.6,169.68,166.04,2140675.0,40618.0,168.578647,AXP
"US Payments Forum July Meeting to Cover PCI DSS 4.0, Faster Payments and Stakeholder Successes",https://www.benzinga.com/pressreleases/22/05/g27479016/us-payments-forum-july-meeting-to-cover-pci-dss-4-0-faster-payments-and-stakeholder-successes,"ENGLEWOOD, Colo., May 31, 2022 ( GLOBE NEWSWIRE ) -- The payments industry is constantly evolving. In an effort to stay ahead of payments trends and address potential challenges, the U.S. Payments Forum today announces its upcoming Summer Member Meeting. The virtual event will bring together ind",-0.100971,Neutral,167.94,168.82,170.78,167.04,4080287.0,46082.0,169.101482,AXP
Travel and Tourism Industry Calls on the Federal Government for Immediate Relief at the Border,https://www.newswire.ca/news-releases/travel-and-tourism-industry-calls-on-the-federal-government-for-immediate-relief-at-the-border-807817291.html,"OTTAWA, ON, June 1, 2022 /CNW/ - The Canadian Travel & Tourism Roundtable ( ""The Roundtable"" ) , comprised of leaders across the travel and tourism industry - with representatives from airlines, airports, hotels, and travel organizations - is calling on the federal government to promote a ...",-0.069332,Neutral,168.7,165.76,169.3688,163.84,2245506.0,44585.0,166.111152,AXP
GlobalData Plc: Buy Now Pay Later to Disrupt the Lending Sector and Payments Industry,https://www.globenewswire.com/news-release/2022/06/02/2455433/0/en/GlobalData-Plc-Buy-Now-Pay-Later-to-Disrupt-the-Lending-Sector-and-Payments-Industry.html,The global Buy Now Pay Later ( BNPL ) market size reached $120 billion in 2021 The global Buy Now Pay Later ( BNPL ) market size reached $120 billion in 2021,0.067854,Neutral,166.14,169.14,169.19,165.93,1686679.0,34981.0,168.067032,AXP
American Express Makes Wells Fargo Financial Stock List,https://www.thestreet.com/investing/bank-of-america-financial-stocks,"Financial stocks haven't fared well this year, with the KBW Bank stock Index dropping 15.5% year to date.",-0.046093,Neutral,166.9,166.83,168.04,165.98,1386776.0,30427.0,166.915813,AXP
Event Foundry Launches Turnkey Event Marketing & Communications Services,https://www.benzinga.com/pressreleases/22/06/g27566799/event-foundry-launches-turnkey-event-marketing-communications-services,"SAN FRANCISCO and DENVER, June 06, 2022 ( GLOBE NEWSWIRE ) -- Event Foundry, a new event marketing and communications firm, today announced its formation as a new digital agency built to amplify the event experience. The launch comes at a time when events are evolving and are once again crucial",-0.019411,Neutral,169.1,167.02,170.259,166.27,1463751.0,35439.0,167.839757,AXP
"Kiterocket Appoints Amanda Foley as CEO, Strengthens Management Team to Support Agency Growth",https://www.benzinga.com/pressreleases/22/06/g27594448/kiterocket-appoints-amanda-foley-as-ceo-strengthens-management-team-to-support-agency-growth,"PHOENIX and SEATTLE, June 07, 2022 ( GLOBE NEWSWIRE ) -- Things are taking off at Kiterocket, a PR-forward, full-service communications agency driven by engaged and connected category experts. Effective today, co-founder Amanda Foley assumes the role of chief executive officer, while her predece",0.066042,Neutral,164.64,168.69,169.4826,164.45,2064419.0,36010.0,168.373068,AXP
This Foreboding Sign Looms Over American Express's Chart,https://www.benzinga.com/markets/22/06/27610319/this-foreboding-sign-looms-over-american-expresss-chart,"If history is any guide, there may be trouble ahead for shares of American Express AXP. A so-called ""death cross"" has formed on its chart and, not surprisingly, this could be bearish for the stock. What To Know: Many traders use moving average crossover systems to make their decisions.",-0.23169,Somewhat-Bearish,166.75,165.96,168.64,165.19,2299321.0,40468.0,166.390335,AXP
Marriott  ( MAR )  Up 20% in the Past Year: Will the Rally Sustain?,https://www.zacks.com/stock/news/1936938/marriott-mar-up-20-in-the-past-year-will-the-rally-sustain,"Marriott (MAR) is benefiting from improving demand, expansion efforts and a robust loyalty program.",0.131729,Neutral,166.22,160.98,166.57,160.93,2257356.0,46072.0,162.777027,AXP
US lifts COVID-19 test requirement for international travel,https://apnews.com/article/covid-health-travel-government-and-politics-air-af509c58df1c931caac6ecf957ea1aed,"WASHINGTON ( AP ) - The Biden administration is lifting its requirement that international travelers test negative for COVID-19 within a day before boarding a flight to the United States, ending one of the last remaining government mandates designed to contain the spread of the coronavirus.",-0.06619,Neutral,157.26,154.42,157.875,154.36,2710050.0,56898.0,155.231917,AXP
Stocks That Hit 52-Week Lows On Monday,https://www.benzinga.com/markets/options/22/06/27677156/52-weeks-high-and-low-article,"During Monday's trading, 1214 companies set new 52-week lows. The largest company by market cap to set a new 52-week low was Microsoft MSFT. Quoin Pharmaceuticals QNRX was the smallest company by market cap to set a new 52-week low. DexCom DXCM's stock fell the most, as it traded down 76.5% to ...",-0.018781,Neutral,149.86,146.29,151.03,145.38,4067392.0,79266.0,147.453574,AXP
"Flutterwave Appoints Former American Express Executive, Oneal Bhambani as Chief Financial Officer",https://www.prnewswire.com/news-releases/flutterwave-appoints-former-american-express-executive-oneal-bhambani-as-chief-financial-officer-301567837.html,"Having recently completed its $250 million in Series D funding, valuing the company at over $3 billion, Flutterwave is going through a period of rapid growth. As Chief Financial officer, Oneal will serve a key function in enabling the company's expansion with best-in-class discipline, operational ...",0.237563,Somewhat-Bullish,146.96,144.6,147.4,143.25,3557950.0,60114.0,144.883531,AXP
The best Fourth of July travel deals for flights and hotels 2022,https://amp.cnn.com/cnn/cnn-underscored/travel/4th-of-july-travel-deals-flights-hotels,Still don't have Independence Day plans? Here are the best Fourth of July flight and hotel travel deals ...,0.254961,Somewhat-Bullish,146.69,146.22,147.885,143.44,3269128.0,57206.0,146.359132,AXP
Analysis: Air fares and staff gaps threaten transatlantic travel rebound,https://www.reuters.com/business/aerospace-defense/air-fares-staff-gaps-threaten-transatlantic-travel-rebound-2022-06-16/,"A traveller wearing a mask waits near the Delta Airlines counters, after a federal judge in Florida struck down the CDC's public transportation masking order due to the coronavirus disease ( COVID-19 ) prevention efforts, at Logan International Airport in Boston, Massachusetts, U.S., April 19, ...",-0.074255,Neutral,142.59,137.5,142.6,136.49,4774879.0,79554.0,138.012582,AXP
Dow Jones Gains; WWE Stock Slammed As Vince McMahon Steps Down; Moderna Gets Covid Vaccine Boost,https://www.investors.com/market-trend/stock-market-today/dow-jones-up-wwe-stock-slammed-as-ceo-vince-mcmahon-steps-aside-moderna-stock-gets-covid-vaccine-boost/,Dow Jones Gains. WWE Stock Slammed As Vince McMahon Steps Down. Moderna Gets Covid Vaccine Boost Investor's Business Daily ...,0.023892,Neutral,138.0,144.18,145.5604,137.59,9985309.0,100018.0,142.802578,AXP
Amex's M&A head sees more targets looking for capital as she shops for deals,https://www.marketwatch.com/story/amexs-m-a-head-sees-more-targets-looking-for-capital-as-she-shops-for-deals-11655838385,American Express executive Lias Marchese is getting more calls from companies seeking deals amid rocky stock performances and a need for cash.,0.015903,Neutral,148.7,144.76,148.7,144.16,3492971.0,55729.0,145.244418,AXP
Biometric Technologies to Enhance Mobile Payments Security | Globaldata Plc,https://www.globenewswire.com/news-release/2022/06/22/2467376/0/en/Biometric-Technologies-to-Enhance-Mobile-Payments-Security-Globaldata-Plc.html,The global mobile payments market was worth $55.7 trillion in 2021 The global mobile payments market was worth $55.7 trillion in ...,0.078731,Neutral,142.23,144.39,146.35,141.341,3398097.0,48080.0,144.455267,AXP
Rise of women to top of UK finance is 'stagnating',https://www.reuters.com/business/finance/rise-women-top-uk-finance-is-stagnating-2022-06-23/,"The City of London financial district is seen in London, Britain, October 22, 2021. REUTERS/Hannah McKay LONDON, June 23 ( Reuters ) - Britain's six-year drive to increase the number of women in senior management at financial firms is ""stagnating"" for the first time, a review for the finance ...",-0.238616,Somewhat-Bearish,144.52,141.65,144.63,139.47,3843154.0,60723.0,141.405442,AXP
Analyzing American Express's Short Interest,https://www.benzinga.com/short-sellers/22/06/27845894/axp-analyzing-american-expresss-short-interest,"American Express's ( NYSE:AXP ) short percent of float has risen 11.11% since its last report. The company recently reported that it has 9.77 million shares sold short, which is 1.3% of all regular shares that are available for trading.",-0.341262,Somewhat-Bearish,141.63,146.15,146.27,141.0,8887633.0,67008.0,145.521263,AXP
How to find cheap flights for your summer vacation,https://www.cnn.com/cnn-underscored/travel/how-to-find-cheap-flights,"The summer travel season is very much upon us. This year, we've seen demand for summer travel skyrocket. And, rising demand has also brought about booming costs to travel. Great services for finding cheap airfare this summer",0.34033,Somewhat-Bullish,147.99,144.29,148.77,143.95,3136767.0,43183.0,145.475105,AXP
Kepler Elevates Joshua Lerman to Global CEO,https://www.benzinga.com/pressreleases/22/06/g27883128/kepler-elevates-joshua-lerman-to-global-ceo,"NEW YORK, June 28, 2022 ( GLOBE NEWSWIRE ) -- Digital marketing services pioneer Kepler Group announced today that company veteran Joshua Lerman has been named Global CEO. This comes on the heels of Kepler co-founder Remy Stiles' appointment as CEO for North America, the company's largest region.",0.081457,Neutral,146.08,142.19,149.51,141.85,2699499.0,46416.0,143.989728,AXP
"Mastercard  ( MA ) , Softcell Tie Up to Boost Cybersecurity in India",https://www.zacks.com/stock/news/1945793/mastercard-ma-softcell-tie-up-to-boost-cybersecurity-in-india,"Mastercard (MA) collaborates with Softcell, which will distribute MA's RiskRecon to its customers across India and empower them to counter cybersecurity threats.",0.067184,Neutral,141.65,139.47,141.675,138.45,4132840.0,59968.0,139.433808,AXP
"COVID-19 pandemic helped top US public payment companies generate $178 billion of aggregate revenue, says GlobalData",https://www.investorideas.com/news/2022/technology/06301Public-Payment-Companies.asp,"COVID-19 pandemic helped top US public payment companies generate $178 billion of aggregate revenue, says ...",0.064676,Neutral,136.7,138.62,139.86,134.3,4082532.0,55015.0,137.555205,AXP
"Apple, Microsoft, Disney And American Express Continue To Plummet: Dow Jones Index Has Worst First Half In Decades",https://www.benzinga.com/news/large-cap/22/06/27923049/apple-microsoft-disney-and-american-express-continue-to-plummet-dow-jones-index-has-worst-first-ha,"The U.S. Stock Market has had a rough 2022 so far and the SPDR Dow Jones Industrial Average ETF Trust DIA has been no exception to that. Since the start of the calendar year, the index has lost close to 6,000 points as inflation continues to rise and consumer spending falls.",-0.362552,Bearish,138.07,140.4,140.89,137.47,2593616.0,43055.0,139.417075,AXP
Why American Express  ( AXP )  Could Beat Earnings Estimates Again,https://www.zacks.com/stock/news/1948144/why-american-express-axp-could-beat-earnings-estimates-again,American Express (AXP) has an impressive earnings surprise history and currently possesses the right combination of the two key ingredients for a likely beat in its next quarterly report.,0.119082,Neutral,137.22,139.65,139.65,135.65,4026399.0,56935.0,138.270243,AXP
Here's Why You Should Retain American Express  ( AXP )  Stock,https://www.zacks.com/stock/news/1948724/heres-why-you-should-retain-american-express-axp-stock,"American Express (AXP) continues to be driven by higher revenues, enhanced card offerings suite to sustain its position in the commercial payments industry and sufficient cash-generating abilities.",0.09042,Neutral,139.29,138.15,140.5,137.85,4351244.0,58436.0,138.766041,AXP
American Express Whale Trades For July 07,https://www.benzinga.com/markets/options/22/07/27991500/american-express-whale-trades-for-july-07,"Someone with a lot of money to spend has taken a bullish stance on American Express AXP. We noticed this today when the big position showed up on publicly available options history that we track here at Benzinga. Whether this is an institution or just a wealthy individual, we don't know.",-0.04479,Neutral,140.18,141.03,142.17,139.15,4240632.0,59379.0,140.779892,AXP
"The Dow Fell 46 Points, But These 3 Stocks Eked Out Gains",https://www.fool.com/investing/2022/07/08/the-dow-fell-46-points-but-these-3-stocks-eked-out/,An interesting jobs report had investors scratching their heads today.,0.078448,Neutral,141.97,141.76,143.11,139.72,3608185.0,45463.0,141.764517,AXP
Klarna's Valuation Suffers an 85% Decline to USD6.7 Billion,https://www.financialbuzz.com/klarnas-valuation-suffers-an-85-decline-to-usd6-7-billion/,"Klarna's valuation was cut by 85% during a new financing round disclosed Monday, portraying poor investor sentiment towards high-growth tech stocks and ""buy now, pay later"" companies. The financing round ultimately raised USD800 Million at a valuation of USD6.7 Billion, down from the USD45.6 ...",0.094757,Neutral,140.47,140.58,142.31,139.835,2340924.0,37897.0,140.899734,AXP
Stocks Market Mixed As Earnings Season Begins; Investors Look Ahead To Wednesday Inflation Data,https://www.investors.com/market-trend/stock-market-today/stock-market-mixed-as-earnings-season-begins-investors-keep-a-close-eye-on-wednesdays-inflation-rate/,Stocks Mixed As Earnings Season Begins. Investors Keep A Close Eye On Wednesday's Inflation Rate Investor's Business Daily ...,-0.031637,Neutral,137.53,139.18,141.89,137.0601,4034143.0,47289.0,139.894312,AXP
"If You Invested $100 In This Stock 20 Years Ago, You Would Have $500 Today",https://www.benzinga.com/news/earnings/22/07/28052010/if-you-invested-100-in-this-stock-20-years-ago-you-would-have-500-today,"American Express AXP has outperformed the market over the past 20 years by 1.04% on an annualized basis producing an average annual return of 8.99%. Currently, American Express has a market capitalization of $104.48 billion.",0.160819,Somewhat-Bullish,136.84,139.4,140.02,136.36,2719905.0,45750.0,138.918321,AXP
MarketAxess  ( MKTX )  Gears Up for Q2 Earnings: What's in Store?,https://www.zacks.com/stock/news/1952489/marketaxess-mktx-gears-up-for-q2-earnings-whats-in-store,MarketAxess' (MKTX) second-quarter results are likely to be affected by higher costs and expenses.,0.200205,Somewhat-Bullish,135.7,136.48,137.24,134.12,4573038.0,63718.0,136.133266,AXP
Nasdaq  ( NDAQ )  To Report Q2 Earnings: What's In The Cards?,https://www.benzinga.com/22/07/28082087/nasdaq-ndaq-to-report-q2-earnings-whats-in-the-cards,"Nasdaq, Inc. ( NASDAQ: NDAQ ) is slated to report second-quarter 2022 earnings on Jul 20, before the opening bell. The company delivered an earnings surprise in each of the last four quarters, the average being 5.9%.",0.247654,Somewhat-Bullish,139.71,142.48,143.11,138.87,3282086.0,46077.0,141.822601,AXP
Monday's Market Minute: Three Things To Watch This Week,https://www.benzinga.com/news/earnings/22/07/28101781/mondays-market-minute-three-things-to-watch-this-week,"There's another busy week ahead, so let's take a market minute to get ahead of the three things you should be dialed in on. First we have the last of the big banks reporting today, Goldman Sachs GS and Bank of America BAC are set to release quarterly results this morning.",0.053327,Neutral,144.34,142.33,146.05,141.535,3314879.0,50417.0,143.457013,AXP
This Is What Whales Are Betting On American Express,https://www.benzinga.com/markets/options/22/07/28119470/this-is-what-whales-are-betting-on-american-express,"Someone with a lot of money to spend has taken a bearish stance on American Express AXP. We noticed this today when the big position showed up on publicly available options history that we track here at Benzinga. Whether this is an institution or just a wealthy individual, we don't know.",0.1136,Neutral,144.4,147.78,147.93,144.4,3355732.0,45890.0,146.963911,AXP
