Article Headline,Article URL,Article Text,overall_sentiment_score,overall_sentiment_label,Stock Open,Stock Close,Stock High,Stock Low,volume,num_trades,adj_close,Ticker
ProKidney Strengthens Board of Directors with Appointments of Dr. John M. Maraganore and Jennifer Fox,https://investingnews.com/prokidney-strengthens-board-of-directors-with-appointments-of-dr-john-m-maraganore-and-jennifer-fox/,"Maraganore brings more than 35 years of scientific, research and development, capital markets and managerial leadership expertise to ProKidney Fox joins Board with more than 25 years of healthcare investment banking, finance and capital markets experience",0.11404,Neutral,110.0,106.01,110.895,105.06,4178656.0,62557.0,107.420197,BX
Analysis: How Carlyle CEO Kewsong Lee's turnaround of the private equity firm was cut short,https://www.reuters.com/business/finance/how-carlyle-ceo-kewsong-lees-turnaround-private-equity-firm-was-cut-short-2022-08-12/,"NEW YORK, Aug 12 ( Reuters ) - Kewsong Lee bolstered Carlyle Group Inc's growth after he took over the reins in 2018, yet the private equity firm continued to play catchup with its larger and more diversified publicly listed rivals, according to people close to the situation, analysts and ...",0.229999,Somewhat-Bullish,107.9,108.79,108.8,106.31,2535895.0,31270.0,107.960852,BX
BMI pulls sale plans amid music rights slowdown,https://www.axios.com/pro/media-deals/2022/08/15/bmi-pulls-sale-plans-music-rights,Broadcast Music Inc. pulls sale plans amid music rights slowdown ...,0.048918,Neutral,107.69,108.68,110.0,107.14,3041329.0,39196.0,108.935543,BX
Elliott gets active in Cardinal Health,https://www.axios.com/pro/health-tech-deals/2022/08/16/cardinal-health-elliott-management-activist,Activist Elliott Management takes Cardinal Health stake ...,0.188823,Somewhat-Bullish,107.53,107.58,108.28,105.49,3403503.0,47097.0,107.231253,BX
"Blackstone to sell Sona BLW's shares worth nearly Rs 4,000 cr tomorrow",https://www.business-standard.com/article/companies/blackstone-to-sell-sona-blw-s-shares-worth-nearly-rs-4-000-cr-tomorrow-122081701226_1.html,"Sona BLW block deal tomorrow at Rs 500 per share, a 7.2% discount to ...",0.144973,Neutral,105.0,106.5,107.23,104.835,2254193.0,31029.0,106.084881,BX
Blackstone sells 13.6% stake in auto component maker Sona BLW for Rs 4k cr,https://www.business-standard.com/article/companies/blackstone-sells-13-6-stake-in-auto-component-maker-sona-blw-for-rs-4k-cr-122081801150_1.html,"Private equity firm Blackstone on Thursday divested 13.6 per cent stake in auto component maker Sona BLW Precision Forgings Ltd for over Rs 4,000 crore through open market transactions. The shares were picked up by the Government of Singapore and SBI Mutual Fund among others, bulk deal data with ...",0.101835,Neutral,106.3,107.34,107.4,105.8,1718661.0,22918.0,106.77824,BX
Apollo backs GI Alliance's physician-led buyout,https://www.axios.com/pro/health-tech-deals/2022/08/19/apollo-backs-gi-alliances-physician-led-buyout,GI Alliance's physician owners are buying back the minority equity stake held by Waud Capital Partners as part of an Apollo-backed physician buyout that values the gastroenterology organization at $2.2 billion.,0.266682,Somewhat-Bullish,105.58,103.3,105.75,102.6,4133480.0,48293.0,103.503454,BX
Hasbro revisits eOne,https://www.axios.com/pro/retail-deals/2022/08/22/hasbro-revisits-eone,Hasbro revisits ...,0.184593,Somewhat-Bullish,100.68,101.0,101.65,98.93,3495067.0,47038.0,100.602777,BX
Senator Wyden At Senate Finance Announces Investigation Of Abusive Private Placement Life Insurance  ( PPLI )  Transactions,https://www.forbes.com/sites/jayadkisson/2022/08/23/senator-wyden-at-senate-finance-announces-investigation-of-abusive-private-placement-life-insurance-ppli-transactions/,"Senator Wyden of the U.S. Senate Finance Committee has issued a press release announcing the investigation of so-called Private Placement Life Insurance (""PPLI"") policies and arrangements.",0.057951,Neutral,101.03,102.35,103.65,101.02,2186933.0,31619.0,102.518221,BX
Flurry of block deals lifts cash trading market volumes from two-year lows,https://www.business-standard.com/article/markets/flurry-of-block-deals-lifts-cash-trading-market-volumes-from-two-year-lows-122082401085_1.html,"The rebound coincided with optimism that the US Federal Reserve may ease up on its pace of monetary tightening, prompting a recovery in stocks the world over ...",0.048324,Neutral,102.05,102.76,103.95,101.24,2122733.0,26891.0,102.918822,BX
Will Blackstone Secured Lending Fund  ( BXSL )  Gain on Rising Earnings Estimates?,https://www.zacks.com/stock/news/1972593/will-blackstone-secured-lending-fund-bxsl-gain-on-rising-earnings-estimates,"Blackstone Secured Lending Fund (BXSL) shares have started gaining and might continue moving higher in the near term, as indicated by solid earnings estimate revisions.",0.424449,Bullish,103.8,105.44,105.462,103.41,1919075.0,24348.0,104.688495,BX
Blackstone eyes IPO filing for $2.5 bn in shopping mall portfolio: Report,https://www.business-standard.com/article/markets/blackstone-eyes-ipo-filing-for-2-5-bn-in-shopping-mall-portfolio-report-122082601472_1.html,"Nexus Malls operates 17 shopping centers across 13 Indian cities and has about 10 million square feet of retail space, its website shows ...",0.134529,Neutral,105.01,98.55,105.626,98.41,5064204.0,62010.0,100.012165,BX
Why Bluerock Residential Growth Stock Is Rising,https://www.benzinga.com/news/small-cap/22/08/28670238/why-bluerock-residential-growth-shares-are-rising,Bluerock Residential Growth REIT Inc Class A BRG shares are trading higher by 5.26% to $26.70 Monday morning after the company said it expects to be acquired by Blackstone Real Estate around October 6th.,0.228637,Somewhat-Bullish,97.25,96.19,97.8,95.9,3371979.0,47128.0,96.647045,BX
Highly Unusual Deal Allows David Blitzer To Buy 35% Of Cleveland Guardians,https://www.forbes.com/sites/mikeozanian/2022/08/30/highly-unusual-deal-allows-david-blitzer-to-buy-35-of-cleveland-guardians/,"A few years ago, when the Dolan family and John Sherman wanted to unload the Cleveland Guardians there was more than one bidder willing to pay $1.4 billion for the MLB team.",0.038379,Neutral,97.0,95.62,98.13,94.31,3323443.0,39930.0,95.531515,BX
"Significant reduction in debt burden to Rs 1,810 cr till Mar 31: Coffee Day",https://www.business-standard.com/article/companies/significant-reduction-in-debt-burden-to-rs-1-810-cr-till-mar-31-coffee-day-122083100631_1.html,"The debt level of Coffee Day Enterprises has been reduced ""significantly"" to Rs 1,810 crore as on March 31, the company said in its latest annual report. However, there have been certain defaults in repayments of principal and interest of the loans and certain lenders have exercised their rights ...",0.134192,Neutral,96.88,93.94,97.22,93.78,3884608.0,39828.0,94.743043,BX
CIXX vs. BX: Which Stock Is the Better Value Option?,https://www.zacks.com/stock/news/1975410/cixx-vs-bx-which-stock-is-the-better-value-option,Investors interested in stocks from the Financial - Miscellaneous Services sector have probably already heard of CI Financial Corp. ( CIXX Quick QuoteCIXX - Free Report ) and Blackstone Inc. ( BX Quick QuoteBX - Free Report ) . But which of these two stocks offers value investors a better bang ...,0.490282,Bullish,93.0,94.15,94.31,91.1,3755193.0,46930.0,92.763089,BX
3 Top Finance Stocks to Buy in September,https://www.fool.com/investing/2022/09/02/3-top-finance-stocks-to-buy-in-september/,"These stocks are each down 27% or more from their peaks, and at these levels, they're screaming value buys for long-term investors.",0.312099,Somewhat-Bullish,96.51,93.82,96.95,92.92,3610462.0,45329.0,94.580075,BX
Is Most-Watched Stock Blackstone Inc.  ( BX )  Worth Betting on Now?,https://www.zacks.com/stock/news/1976845/is-most-watched-stock-blackstone-inc-bx-worth-betting-on-now,"Recently, Zacks.com users have been paying close attention to Blackstone Inc. (BX). This makes it worthwhile to examine what the stock has in store.",0.240073,Somewhat-Bullish,94.58,94.09,95.28,92.3,2267992.0,36184.0,93.921651,BX
Igneo Infrastructure Partners appoints Michael Ryder as partner and co-head of North American business to further drive expansion,https://www.prnewswire.com/news-releases/igneo-infrastructure-partners-appoints-michael-ryder-as-partner-and-co-head-of-north-american-business-to-further-drive-expansion-301619438.html,"NEW YORK, Sept. 7, 2022 /PRNewswire/ -- Igneo Infrastructure Partners, a global infrastructure investment manager, has appointed Michael Ryder as a partner and co-head of the firm's North American business. Michael will join John Ma in spearheading Igneo's growth and expansion plans in the region.",0.376757,Bullish,93.77,96.34,96.7,93.61,2052846.0,28256.0,95.525303,BX
Are Defense Stocks Now ESG?,https://www.forbes.com/sites/jacobwolinsky/2022/09/08/are-defense-stocks-now-esg/,"Defense companies have also long been avoided in ESG portfolios, but several funds added the sector to their holdings due to the war and tensions in Europe ...",-0.050867,Neutral,95.04,96.9,97.23,94.74,2584981.0,31169.0,96.414056,BX
Tech private equity vets raise $3 billion for digitization fund,https://www.axios.com/2022/09/09/tech-private-equity-roux-baypine,"BayPine, a Boston-based midmarket buyout firm led by David Roux ( ex-Silver Lake ) and Anjan Mukherjee ( ex-Blackstone ) , raised $2.2 billion for its debut fund. It also secured $800 million in co-investment commitments.",0.219501,Somewhat-Bullish,97.56,99.67,100.0447,97.27,2303708.0,32938.0,99.417532,BX
This AIG spinoff is the biggest IPO of the year at just $1.8 billion as 2022 deals dry up,https://www.marketwatch.com/story/this-aig-spinoff-is-the-biggest-ipo-of-the-year-at-just-1-8-billion-as-2022-deals-dry-up-11663008325,The U.S. initial public offering market is facing what may be the biggest deal of the year this week as AIG spinoff Corebridge Financial seeks to raise up to $1.8 billion in proceeds.,0.011948,Neutral,100.5,100.82,102.4,100.0021,2273817.0,31062.0,101.019632,BX
Baring Private Equity raises $11.2 bln in one of Asia's largest buyout funds,https://www.reuters.com/markets/europe/baring-private-equity-raises-112-bln-one-asias-largest-buyout-funds-2022-09-13/,"Register now for FREE unlimited access to Reuters.com Register HONG KONG, Sept 13 ( Reuters ) - Hong Kong-based Baring Private Equity Asia ( BPEA ) has closed its eighth,and largest, pan-Asia fund at $11.2 billion, the firm said on Tuesday.",0.118177,Neutral,96.76,94.37,96.78,93.62,5152691.0,66158.0,94.992696,BX
Prudent Shipping Investments closes financing for 2 modern Supramax bulk carriers valued at USD45mn,https://www.prnewswire.com/in/news-releases/prudent-shipping-investments-closes-financing-for-2-modern-supramax-bulk-carriers-valued-at-usd45mn-818103558.html,"SINGAPORE, Sept. 14, 2022 /PRNewswire/ -- Prudent Shipping Investments ( Prudent ) , a Singapore based Company, has today ( 14th September 2022 ) closed financing for 2 modern Supramax bulk carriers ( a KHI58 and a Tsuneshi58 ) valued at USD45mn.",0.31821,Somewhat-Bullish,94.98,95.36,96.01,93.9,2656646.0,35397.0,95.164645,BX
"Blackstone Secured  ( NYSE:BXSL ) , Medallion Finl  ( NASDAQ:MFIN ) , Capital One Financial  ( NYSE:COF ) , Landmark Bancorp  ( NASDAQ:LARK ) , Brookline Bancorp  ( NASDAQ:BRKL )  - 5 Value Stocks In The Financial Services Sector",https://www.benzinga.com/news/22/09/28883948/5-value-stocks-in-the-financial-services-sector,A value stock is traditionally defined in terms of how investors in the marketplace are valuing that company's future growth prospects. Low P/E multiples are good base indicators that the company is undervalued and can most likely be labelled as a value stock.,0.381785,Bullish,94.75,94.7,95.9,92.52,2454969.0,36157.0,94.75543,BX
Soccer Germany's DFL to kick off Bundesliga media rights sale in October - sources,https://www.reuters.com/markets/europe/soccer-germanys-dfl-kick-off-bundesliga-media-rights-sale-october-sources-2022-09-16/,"MUNICH, Sept 16 ( Reuters ) - Germany's soccer governing body is due to meet a second group of private equity investors on Monday before launching the sale of a $3.6 billion stake in the Bundesliga's media rights business towards the end of October, four sources told Reuters.",0.086307,Neutral,92.7,92.18,92.7,90.71,5776296.0,60127.0,91.890671,BX
Blackstone Mortgage  ( BXMT )  Moves to Strong Buy: Rationale Behind the Upgrade,https://www.zacks.com/stock/news/1982189/blackstone-mortgage-bxmt-moves-to-strong-buy-rationale-behind-the-upgrade,"Blackstone Mortgage (BXMT) has been upgraded to a Zacks Rank #1 (Strong Buy), reflecting growing optimism about the company's earnings prospects. This might drive the stock higher in the near term.",0.312225,Somewhat-Bullish,90.88,95.15,95.15,90.54,3093318.0,40692.0,93.891997,BX
Ecobat Appoints New Chief Financial Officer,https://www.prnewswire.com/news-releases/ecobat-appoints-new-chief-financial-officer-301628519.html,"IRVING, Texas, Sept. 20, 2022 /PRNewswire/ -- Ecobat, the global leader in battery recycling, is announcing the appointment of Lloyd McGuire as Chief Financial Officer.",0.249495,Somewhat-Bullish,94.0,90.94,94.72,89.5201,4219727.0,55362.0,91.062987,BX
The Use Of 3D Printing Technology Is Rising In The Modular And Prefabricated Nonresidential Building Construction Market,https://www.prnewswire.com/news-releases/the-use-of-3d-printing-technology-is-rising-in-the-modular-and-prefabricated-nonresidential-building-construction-market-301627055.html,"The Business Research Company's global modular and prefabricated nonresidential building construction market report expands on key drivers, trends, and growth opportunities in the market.",0.208928,Somewhat-Bullish,91.93,88.77,94.0,88.73,3669898.0,42260.0,90.895889,BX
This Is What Whales Are Betting On Blackstone - Blackstone  ( NYSE:BX ) ,https://www.benzinga.com/markets/options/22/09/28969159/this-is-what-whales-are-betting-on-blackstone,"A whale with a lot of money to spend has taken a noticeably bearish stance on Blackstone. Looking at options history for Blackstone BX we detected 14 strange trades. If we consider the specifics of each trade, it is accurate to state that 21% of the investors opened trades with bullish ...",0.135349,Neutral,88.03,85.4,88.75,84.11,7472166.0,87772.0,85.430435,BX
"Exclusive: Blackstone to sell $400 mln stake in Indian REIT Embassy, ADIA eyes investment",https://www.reuters.com/markets/europe/exclusive-blackstone-sell-400-mln-stake-indian-reit-embassy-adia-eyes-investment-2022-09-23/,"MUMBAI, Sept 23 ( Reuters ) - Blackstone Inc will sell a stake worth up to $400 million in Embassy Office Parks REIT ( EMBA.NS ) , India's biggest real estate investment trust, via Indian stock exchange block deals, three sources familiar with the matter told Reuters.",0.07134,Neutral,83.73,83.5,84.17,82.22,6455120.0,66723.0,82.953963,BX
Former Capitol Police Chief Steven A. Sund Set To Publish A New Book About The Attack On January 6th With Explosive Never-Before-Revealed Information,https://www.benzinga.com/pressreleases/22/09/n29015841/former-capitol-police-chief-steven-a-sund-set-to-publish-a-new-book-about-the-attack-on-january-6t,"New book by Former Capitol Police Chief Steven A. Sund containing explosive, new information about the Attack on January 6th is announced: COURAGE UNDER FIRE: UNDER SIEGE AND OUTNUMBERED 58 TO 1 ON JANUARY 6.",-0.119316,Neutral,83.07,83.16,84.9689,82.725,4224527.0,48577.0,83.420115,BX
"This is why Byju Raveendran's last 6 months were 'toughest', reveals wife",https://www.business-standard.com/article/companies/this-is-why-byju-raveendran-s-last-6-months-were-toughest-reveals-wife-122092701313_1.html,"BYJU's Co-founder Divya Gokulnath revealed that last 6 months were super tough for her husband not only on professional front, but also in personal life as his father was fighting late-stage cancer ...",-0.060705,Neutral,84.99,81.95,86.17,81.83,6037180.0,76474.0,82.726786,BX
"Exclusive: Hong Kong is back, and the financial world welcomes it, HKMA says",https://www.scmp.com/business/banking-finance/article/3194162/hong-kongs-november-financial-summit-gets-endorsement,"The meeting, with the theme ""Navigating Beyond Uncertainty"", will be the biggest congregation of global financial heavyweights in Hong Kong since the Covid-19 pandemic drove the city into three years of quarantines and social-distancing.",0.120821,Neutral,82.61,86.01,86.3499,81.66,6524747.0,58545.0,84.262891,BX
Brookfield buys US renewable developers for $1.5B,https://www.foxbusiness.com/energy/brookfield-buys-us-renewable-developers-1-5b,"One of the world's biggest clean-energy investors is buying a pair of U.S. renewable developers for $1.5 billion, in bets that add to the money flooding into projects despite this year's market volatility.",0.285782,Somewhat-Bullish,84.35,84.46,85.14,83.22,4390353.0,54621.0,84.147474,BX
Global Sodium-Ion Batteries Market to Reach $4.36 Billion by 2031 - Exclusive DeepTech M-A-PTM Analysis by BIS Research,https://www.prnewswire.com/news-releases/global-sodium-ion-batteries-market-to-reach-4-36-billion-by-2031--exclusive-deeptech-m-a-ptm-analysis-by-bis-research-301637620.html,"Sodium is more abundant than lithium and has an almost infinite supply, with far lower overall extraction and purification costs. Thus, sodium-ion-based batteries are becoming more popular as a potentially competitive technology to Li-ion batteries in certain applications.",0.335185,Somewhat-Bullish,84.55,83.7,85.6,83.0,4799638.0,48639.0,84.456902,BX
Private equity circles European soccer TV rights,https://www.axios.com/pro/media-deals/2022/10/03/private-equity-circles-european-soccer-tv-rights,Some of the top European soccer leagues are attracting tons of interest from private equity firms who want in on their media rights business. Why it matters: The explosion of media rights fees has led to a gold rush among investors who want to ride a wave that's still growing.,0.163781,Somewhat-Bullish,85.08,86.49,87.0,84.3765,3158948.0,42380.0,86.171358,BX
What Are Whales Doing With Blackstone - Blackstone  ( NYSE:BX ) ,https://www.benzinga.com/markets/options/22/10/29138203/what-are-whales-doing-with-blackstone,"A whale with a lot of money to spend has taken a noticeably bearish stance on Blackstone. Looking at options history for Blackstone BX we detected 12 strange trades. If we consider the specifics of each trade, it is accurate to state that 33% of the investors opened trades with bullish ...",0.139545,Neutral,88.9,93.52,93.54,88.73,5858801.0,67924.0,92.202511,BX
CIXX vs. BX: Which Stock Is the Better Value Option?,https://www.zacks.com/stock/news/1988222/cixx-vs-bx-which-stock-is-the-better-value-option,Investors looking for stocks in the Financial - Miscellaneous Services sector might want to consider either CI Financial Corp. ( CIXX Quick QuoteCIXX - Free Report ) or Blackstone Inc. ( BX Quick QuoteBX - Free Report ) . But which of these two stocks offers value investors a better bang for ...,0.519639,Bullish,91.17,92.04,92.71,90.215,3497934.0,38871.0,91.673386,BX
Emerson  ( EMR )  Reportedly in Asset-Sale Talks With Blackstone,https://www.zacks.com/stock/news/1988868/emerson-emr-reportedly-in-asset-sale-talks-with-blackstone,Emerson (EMR) is reportedly in talks with Blackstone to sell part of its commercial and residential solutions business in a deal that could be valued in the range of $5-$10 billion.,0.248597,Somewhat-Bullish,91.63,91.61,93.4,91.21,2730871.0,34968.0,91.95609,BX
Morgan Stanley sees 12% CAGR for private capital market over next five years,https://www.reuters.com/markets/europe/morgan-stanley-sees-12-cagr-private-capital-market-over-next-five-years-2022-10-07/,"Oct 7 ( Reuters ) - Private capital market is set to grow at a 12% annual rate on a compounded basis to $17 trillion in assets under management ( AUM ) over the next five years, Morgan Stanley analysts said on Friday.",0.209456,Somewhat-Bullish,89.48,86.38,89.97,85.81,4442714.0,50145.0,86.924616,BX
Here's how uber-rich pass wealth to heirs tax-free when markets are down,https://www.cnbc.com/2022/10/10/heres-how-uber-rich-pass-wealth-tax-free-to-heirs-when-markets-are-down.html,"Wealthy people, like Michael Bloomberg and Mark Zuckerberg, have used grantor-retained annuity trusts. The trusts have better odds of success in down markets.",0.226689,Somewhat-Bullish,87.16,85.5,87.91,85.12,2783908.0,36615.0,85.962016,BX
Beat the Dow Jones With This Unstoppable Dividend Stock,https://www.fool.com/investing/2022/10/11/beat-the-dow-jones-with-this-unstoppable-dividend/,This fast-growing asset management firm is on track for another record year as people flock to alternative assets.,0.250545,Somewhat-Bullish,84.92,83.44,85.585,82.06,5391837.0,55785.0,83.437128,BX
The 7 Habits Of Highly Successful Investors: A Hedge Fund Tribute,https://www.forbes.com/sites/dominiquemielle/2022/10/12/the-7-habits-of-highly-successful-investors-a-hedge-fund-tribute/,Want a guide to the 7 habits of billionaire hedge fund investors? Here it is!,0.077276,Neutral,83.53,85.54,86.23,83.03,3757724.0,43085.0,84.965913,BX
"Stocks Crumble After Higher-Than-Expected Reading on September Consumer Prices - BlackRock  ( NYSE:BLK ) , Citigroup  ( NYSE:C ) ",https://www.benzinga.com/markets/22/10/29253925/stocks-crumble-after-higher-than-expected-reading-on-september-consumer-prices,"( Thursday Market Open ) Well, that wasn't helpful. Consumer prices surged again in September, the Department of Labor said Thursday, rising 0.4% and topping Wall Street's average estimates for a 0.2% gain. Price growth also accelerated from 0.1% in August.",-0.043482,Neutral,81.17,86.31,86.85,79.545,5341969.0,59534.0,84.226638,BX
"U.K. assets are 'absolutely' a buy, says Blackstone's Jonathan Gray",https://www.marketwatch.com/story/u-k-assets-are-absolutely-a-buy-says-blackstones-jonathan-gray-11665690960,Blackstone's president spoke with MarketWatch about the U.S. and U.K. economies at a MarketWatch 25th anniversary event.,0.186221,Somewhat-Bullish,86.86,84.12,88.4,83.89,2880227.0,36731.0,84.977782,BX
"Solid Start: Week Begins in the Green After Bank of America Earnings Impress, Yields Fall - Bank of America  ( NYSE:BAC ) ",https://www.benzinga.com/news/earnings/22/10/29291358/solid-start-week-begins-in-the-green-after-bank-of-america-earnings-impress-yields-fall,"( Monday Market Open ) Falling Treasury yields, hopes for improved stability in the U.K., and early strength in mega-cap stocks gave the market an initial boost Monday. But don't get too comfortable. Everyone's seen the wild swings lately, and volatility remains high with lots of major earnings ...",-0.024326,Neutral,86.16,88.23,88.415,86.13,3702895.0,43122.0,87.909959,BX
PE Deals Misfire; Losses Pile As Tesla CEO's Musk Takes Twitter Private,https://www.investors.com/research/pe-deals-misfire-losses-pile-as-tesla-ceo-musk-tries-to-take-twitter-private/,PE Deals Misfire. Losses Pile As Tesla CEO's Musk Takes Twitter Private Investor's Business Daily ...,0.022052,Neutral,91.06,90.12,93.13,88.71,4691228.0,53724.0,90.567201,BX
"Tug of War: Can Stronger-Than-Expected Earnings Outweigh Rising Yields? - Netflix  ( NASDAQ:NFLX ) , Procter & Gamble  ( NYSE:PG ) ",https://www.benzinga.com/markets/22/10/29329540/tug-of-war-can-stronger-than-expected-earnings-outweigh-rising-yields,"( Wednesday Market Open ) Treasury yields held up a ""stop"" sign Wednesday after a two-day rally as investors awaited Tesla ( TSLA ) earnings this afternoon. The 10-year Treasury yield ( TNX ) drove uphill this morning to 4.1%, near 2022 highs.",0.045702,Neutral,89.87,87.74,90.05,86.85,4098268.0,48581.0,87.981791,BX
Blackstone Inc.  ( BX )  Q3 2022 Earnings Call Transcript,https://www.fool.com/earnings/call-transcripts/2022/10/20/blackstone-inc-bx-q3-2022-earnings-call-transcript/,"BX earnings call for the period ending September 30, 2022.",0.264811,Somewhat-Bullish,88.07,84.04,88.335,82.95,7793188.0,82749.0,84.888904,BX
Darryl Chan elevated to HKMA deputy CEO from November 1,https://www.scmp.com/business/banking-finance/article/3196834/hkma-appoints-darryl-chan-deputy-ceo-hong-kongs-de-facto-central-bank-november-1,"Darryl Chan Wai-man, currently the executive director (external), takes over as deputy chief executive from Edmond Lau Ying-pan, who has opted for early retirement.",0.203803,Somewhat-Bullish,84.2,85.43,85.7,82.6,5179073.0,61683.0,84.395141,BX
"Atlantia's big investors tender shares in Benetton, Blackstone bid - sources",https://www.reuters.com/markets/deals/atlantias-big-investors-tender-shares-benetton-blackstone-bid-sources-2022-10-24/,"A logo of the Atlantia Group is seen outside its headquarters in Rome, Italy August 31, 2018. REUTERS/Alessandro Bianchi",0.174612,Somewhat-Bullish,85.52,86.27,86.6556,82.79,4153670.0,51351.0,84.955857,BX
10% Owner of Blackstone Makes $4.97M Sale - Blackstone  ( NYSE:BX ) ,https://www.benzinga.com/news/22/10/29398924/10-owner-of-blackstone-makes-4-97m-sale,"Blackstone Holdings III L.P., 10% Owner at Blackstone BX, reported a large insider sell on October 24, according to a new SEC filing. What Happened: A Form 4 filing from the U.S. Securities and Exchange Commission on Monday showed that L.P. sold 151,600 shares of Blackstone.",0.127784,Neutral,86.3,91.55,91.6,86.26,5250471.0,67986.0,90.449294,BX
Blackstone Whale Trades For October 26 - Blackstone  ( NYSE:BX ) ,https://www.benzinga.com/markets/options/22/10/29421111/blackstone-whale-trades-for-october-26,"A whale with a lot of money to spend has taken a noticeably bearish stance on Blackstone. Looking at options history for Blackstone BX we detected 12 strange trades. If we consider the specifics of each trade, it is accurate to state that 41% of the investors opened trades with bullish ...",0.082675,Neutral,90.51,92.74,94.11,90.16,4384494.0,52326.0,92.334827,BX
